title,author,source,description,content,pub_date,url,photo_url,combined_text,tokens,lems,keywords
"New poetry: Recounting traumatic personal pasts, Kelly Michels and David McLoghlin speak for traumatised societies",Martina Evans,The Irish Times,Reviews of Geraldine Mitchell’s Naming Love; Kelly Michels’s American Anthem; David McLoghlin’s Crash Centre; and John Mee’s The Blue in the Blue Marble,"a blackbird knaps/ the flint of my heart,/sparks fly Geraldine Mitchell opens Naming Love(Arlen House, 15) with a haiku a succinct herald to her theme of frozen grief alleviated and uplifted by natur… [+7085 chars]",20-10-2024,https://www.irishtimes.com/culture/books/review/2024/10/20/new-poetry-recounting-traumatic-personal-pasts-kelly-michels-and-david-mcloghlin-speak-for-traumatised-societies/,https://www.irishtimes.com/resizer/v2/KO5PWKBYHRGNZH3NRV5ZFI7RDM.jpg?smart=true&auth=9f9d92402a7e7a76b3b2e7346e8b15157af05c9c152983e872fe98e94f07089d&width=1200&height=630,new poetry recounting traumatic personal pasts kelly michels and david mcloghlin speak for traumatised societies a blackbird knaps the flint of my heart sparks fly geraldine mitchell opens naming love arlen house with a haiku a succinct herald to her theme of frozen grief alleviated and uplifted by natur chars,"['new', 'poetry', 'recounting', 'traumatic', 'personal', 'pasts', 'kelly', 'michels', 'david', 'mcloghlin', 'speak', 'traumatised', 'societies', 'blackbird', 'knaps', 'flint', 'heart', 'sparks', 'fly', 'geraldine', 'mitchell', 'opens', 'naming', 'love', 'arlen', 'house', 'haiku', 'succinct', 'herald', 'theme', 'frozen', 'grief', 'alleviated', 'uplifted', 'natur', 'chars']",,[]
"‘When you live with domestic violence, you can never relax – even at nighttime’",Sylvia Thompson,The Irish Times,The National Gallery offers a safe space for survivors of domestic violence to observe and create art as a way to deal with their trauma,"Mary*, a survivor of domestic abuse, describes the cultural art therapy sessions she attended in the National Gallery, Dublin as like a big hug on the inside.
We talked. Some days, we cried. But we … [+6839 chars]",20-10-2024,https://www.irishtimes.com/culture/art/2024/10/20/when-you-live-with-domestic-violence-you-can-never-relax-even-at-nighttime/,https://www.irishtimes.com/resizer/v2/LF5HM6BJPVCIDBOK6ROS7RANUI.jpg?smart=true&auth=23d02fedfc3eca44537300dda1fbce3640215c5808d805d31893d507566c08ae&width=1200&height=630,when you live with domestic violence you can never relax even at nighttime mary a survivor of domestic abuse describes the cultural art therapy sessions she attended in the national gallery dublin as like a big hug on the inside we talked some days we cried but we chars,"['live', 'domestic', 'violence', 'never', 'relax', 'even', 'nighttime', 'mary', 'survivor', 'domestic', 'abuse', 'describes', 'cultural', 'art', 'therapy', 'sessions', 'attended', 'national', 'gallery', 'dublin', 'like', 'big', 'hug', 'inside', 'talked', 'days', 'cried', 'chars']",,[]
Who doesn’t savour another chance to demonise Generation Zed? (Don’t reach out to ‘correct’ my pronunciation),Donald Clarke,The Irish Times,‘Zee’ is an Americanism. So how come it seems to have been used in Ireland since Jack Lynch was taoiseach?,"Life is characterised by endless discoveries of unimportant outrages that have, unnoticed until they smacked you in the face, been making the world a tiny bit worse. Jerks watching video on public tr… [+4566 chars]",20-10-2024,https://www.irishtimes.com/culture/books/2024/10/20/who-doesnt-savour-another-chance-to-demonise-generation-zed-dont-reach-out-to-correct-my-pronunciation/,https://www.irishtimes.com/resizer/v2/NSWUHMMHZRHT7GDEXEECJVM5YQ.jpg?smart=true&auth=84f3a6a6a0caaa74a92747056950d946e04f07aec9bb18398e6ae15f4f783658&width=1200&height=630,who doesn t savour another chance to demonise generation zed don t reach out to correct my pronunciation life is characterised by endless discoveries of unimportant outrages that have unnoticed until they smacked you in the face been making the world a tiny bit worse jerks watching video on public tr chars,"['savour', 'another', 'chance', 'demonise', 'generation', 'zed', 'reach', 'correct', 'pronunciation', 'life', 'characterised', 'endless', 'discoveries', 'unimportant', 'outrages', 'unnoticed', 'smacked', 'face', 'making', 'world', 'tiny', 'bit', 'worse', 'jerks', 'watching', 'video', 'public', 'tr', 'chars']",,[]
Roddy Collins: ‘My biggest regret is telling Johnny Giles when I was 18 to stuff the international team’,Jen Hogan,The Irish Times,"The former professional football and manager on his friendship with Vinny Jones, his love for Achill Island, and what happens when you die","How agreeable are you?
Im very, very agreeable. Its hard for me to say that, but I think if you were to ask my wife and my kids theyd say, My da just gets on with it. Id be very easy-going. As [my w… [+4145 chars]",20-10-2024,https://www.irishtimes.com/life-style/people/2024/10/20/roddy-collins-my-biggest-regret-is-telling-johnny-giles-when-i-was-18-to-stuff-the-international-team/,https://www.irishtimes.com/resizer/v2/UE54LUHMAJGXDAXBK4LKA6OJWI.jpg?smart=true&auth=1569068104c1966473a24541bb406bfad8c99825bcfd4fca149352d1bfd23d53&width=1200&height=630,roddy collins my biggest regret is telling johnny giles when i was to stuff the international team how agreeable are you im very very agreeable its hard for me to say that but i think if you were to ask my wife and my kids theyd say my da just gets on with it id be very easy going as my w chars,"['roddy', 'collins', 'biggest', 'regret', 'telling', 'johnny', 'giles', 'stuff', 'international', 'team', 'agreeable', 'im', 'agreeable', 'hard', 'say', 'think', 'ask', 'wife', 'kids', 'theyd', 'say', 'da', 'gets', 'id', 'easy', 'going', 'w', 'chars']",,[]
Marrying heritage with the fashion future at Avoca: ‘We are on a journey to tell our story to the world’,Deirdre McQuillan,The Irish Times,Newly appointed managing director Brian Handley is putting stronger emphasis on the brand’s 300-year-old history,"The 54 outfits at Avocas winter 24 fashion show, styled by Catherine Condell and held in the lovely Fern House in Kilmacanogue, Co Wicklow, offered a contrast between country outdoor wear and evening… [+5652 chars]",20-10-2024,https://www.irishtimes.com/life-style/fashion/2024/10/20/marrying-heritage-with-the-fashion-future-at-avoca-we-are-on-a-journey-to-tell-our-story-to-the-world/,https://www.irishtimes.com/resizer/v2/CQ6XTLJ635CUJPYSOGCR6XL7QE.png?smart=true&auth=d2777d57ebec09246441b17e645fc851d2d8820e40156da33d5377b1e1ec415d&width=1200&height=630,marrying heritage with the fashion future at avoca we are on a journey to tell our story to the world the outfits at avocas winter fashion show styled by catherine condell and held in the lovely fern house in kilmacanogue co wicklow offered a contrast between country outdoor wear and evening chars,"['marrying', 'heritage', 'fashion', 'future', 'avoca', 'journey', 'tell', 'story', 'world', 'outfits', 'avocas', 'winter', 'fashion', 'show', 'styled', 'catherine', 'condell', 'held', 'lovely', 'fern', 'house', 'kilmacanogue', 'co', 'wicklow', 'offered', 'contrast', 'country', 'outdoor', 'wear', 'evening', 'chars']",,[]
"Latte levy: ‘Now, you’d be ashamed to be seen with a disposable cup’",Joanne Hunt,The Irish Times,The Killarney Coffee Cup Project has so far prevented more than one million single-use coffee cups from reaching landfill or littering the town,"Are you ready for the so-called latte levy? This 20 cent tax on disposable coffee cups aims to deter Irish consumers from dumping half a million of them a day. First mooted by the Government in 2021,… [+3477 chars]",20-10-2024,https://www.irishtimes.com/life-style/people/2024/10/20/latte-levy-now-youd-be-ashamed-to-be-seen-with-a-disposable-cup/,https://www.irishtimes.com/resizer/v2/VBYGIZABI5DORJKPWEAACF2SRQ.jpeg?smart=true&auth=2c05e4770cc28285d9432472d5f2fa06093c395ffb8559498d5448ab75497739&width=1200&height=630,latte levy now you d be ashamed to be seen with a disposable cup are you ready for the so called latte levy this cent tax on disposable coffee cups aims to deter irish consumers from dumping half a million of them a day first mooted by the government in chars,"['latte', 'levy', 'ashamed', 'seen', 'disposable', 'cup', 'ready', 'called', 'latte', 'levy', 'cent', 'tax', 'disposable', 'coffee', 'cups', 'aims', 'deter', 'irish', 'consumers', 'dumping', 'half', 'million', 'day', 'first', 'mooted', 'government', 'chars']",,[]
Adventures in Gdańsk: A few bars of Whiskey in the Jar later and I’m searching for my life jacket,Conor Capplis,The Irish Times,This city with a complicated history has much to offer tourists: just watch out for the trad-singing,"Going on holidays is as much about getting away from the banal as it is about chasing the novel. And while there are familiar sights in Poland, its an often overlooked destination for something diffe… [+9302 chars]",20-10-2024,https://www.irishtimes.com/life-style/travel/2024/10/20/adventures-in-gdansk-a-few-bars-of-whiskey-in-the-jar-later-and-im-searching-for-my-life-jacket/,https://www.irishtimes.com/resizer/v2/VBBXYT5MF5BJ7KRQNYCTG4BZDA.jpg?smart=true&auth=721f2a8fe477330e858b055bc5508975a1b094b79155b1bf13c0ffeda517772a&width=1200&height=630,adventures in gdask a few bars of whiskey in the jar later and i m searching for my life jacket going on holidays is as much about getting away from the banal as it is about chasing the novel and while there are familiar sights in poland its an often overlooked destination for something diffe chars,"['adventures', 'gdask', 'bars', 'whiskey', 'jar', 'later', 'searching', 'life', 'jacket', 'going', 'holidays', 'much', 'getting', 'away', 'banal', 'chasing', 'novel', 'familiar', 'sights', 'poland', 'often', 'overlooked', 'destination', 'something', 'diffe', 'chars']",,[]
Autumn leaf displays have not been as vibrant this year. There’s a good reason for that,Fionnuala Fallon,The Irish Times,Deciduous trees and shrubs are paragons of good planning and preparedness,"It hasnt been a vintage year for autumn colour. For this we can blame the preponderance of wet, windy, overcast weather and the shortage of dry, still, sunny autumnal days combined with a lack of fro… [+7286 chars]",20-10-2024,https://www.irishtimes.com/life-style/gardening/2024/10/20/autumn-leaf-displays-have-not-been-as-vibrant-this-year-theres-a-good-reason-for-that/,https://www.irishtimes.com/resizer/v2/FCGO7ABXPFHXXCA26XFRT4W3F4.jpg?smart=true&auth=d73bea381ba8752e431e74e642d4d6e12d26e0f769f6f22540d34dd009a62e56&width=1200&height=630,autumn leaf displays have not been as vibrant this year there s a good reason for that it hasnt been a vintage year for autumn colour for this we can blame the preponderance of wet windy overcast weather and the shortage of dry still sunny autumnal days combined with a lack of fro chars,"['autumn', 'leaf', 'displays', 'vibrant', 'year', 'good', 'reason', 'hasnt', 'vintage', 'year', 'autumn', 'colour', 'blame', 'preponderance', 'wet', 'windy', 'overcast', 'weather', 'shortage', 'dry', 'still', 'sunny', 'autumnal', 'days', 'combined', 'lack', 'fro', 'chars']",,[]
"Walking the Camino: ‘We spoke about the tension I felt when people spoke of God. I realised, as a gay man, I assume I’ll be judged’",Jamie O'Connell,The Irish Times,The pilgrim walk is famous and cargoed with expectation. Ultimately it might help us find meaning within ourselves,"Last month, I turned 40. Unlike my other zero birthdays, I found I had little interest in marking it with a typical celebration. Forty felt different. I found myself quietly contemplating the fact th… [+8560 chars]",20-10-2024,https://www.irishtimes.com/life-style/people/2024/10/20/walking-the-camino-we-spoke-about-the-tension-i-felt-when-people-spoke-of-god-i-realised-as-a-gay-man-i-assume-ill-be-judged/,https://www.irishtimes.com/resizer/v2/677VXGXEZJGGDLSXZ2BDG7UIL4.jpg?smart=true&auth=bef612087fc5c951862cc2a024478434df1c604ea0f8a3fcb1703bd6d0b8db5d&width=1200&height=630,walking the camino we spoke about the tension i felt when people spoke of god i realised as a gay man i assume i ll be judged last month i turned unlike my other zero birthdays i found i had little interest in marking it with a typical celebration forty felt different i found myself quietly contemplating the fact th chars,"['walking', 'camino', 'spoke', 'tension', 'felt', 'people', 'spoke', 'god', 'realised', 'gay', 'man', 'assume', 'judged', 'last', 'month', 'turned', 'unlike', 'zero', 'birthdays', 'found', 'little', 'interest', 'marking', 'typical', 'celebration', 'forty', 'felt', 'different', 'found', 'quietly', 'contemplating', 'fact', 'th', 'chars']",,[]
"If we don’t expect an improved Government, we won’t get one",Seán Moncrieff,The Irish Times,"Rather than break a promise, Simon Harris might simply change his mind about the timing of the general election","By the time you read this, we might be facing a general election. Or not: depending on what re-electability calculus is the most persuasive among the Government parties. They will want to capitalise … [+3629 chars]",20-10-2024,https://www.irishtimes.com/life-style/people/2024/10/20/sean-moncrieff-not-only-are-voters-cynical-about-politics-so-too-are-politicians/,https://www.irishtimes.com/resizer/v2/5NUH2HUGHU6JTKN2NEZ5S6K7UQ.jpg?smart=true&auth=4823e44e28fec7fc44d3ceaf2ee34b015415cea6b47c11a4c480911f8ca951ff&width=1200&height=630,if we don t expect an improved government we won t get one by the time you read this we might be facing a general election or not depending on what re electability calculus is the most persuasive among the government parties they will want to capitalise chars,"['expect', 'improved', 'government', 'get', 'one', 'time', 'read', 'might', 'facing', 'general', 'election', 'depending', 'electability', 'calculus', 'persuasive', 'among', 'government', 'parties', 'want', 'capitalise', 'chars']",,[]
Detroit’s links with Cork are hard to miss in this city with a subtle swagger and self-assurance,Keith Duggan,The Irish Times,"In the heart of Detroit, the city that spawned the Model-T Ford, there is an area called Corktown","Detroit prides itself on being tougher than the rest so it is going to take a brave soul to inform them that Motor City is just an extension of Cork city, with more soul food and less hurling.
If yo… [+5276 chars]",20-10-2024,https://www.irishtimes.com/world/2024/10/20/detroits-links-with-cork-are-hard-to-miss-in-this-city-with-a-subtle-swagger-and-self-assurance/,https://www.irishtimes.com/resizer/v2/EH34RC5O7FHL3EJ7WQVYBFM7LM.jpg?smart=true&auth=086dcae6b75ba9626f80e09f15f9795382f9a7c9372e40e6aa5e2a9fd19a2761&width=1200&height=630,detroit s links with cork are hard to miss in this city with a subtle swagger and self assurance detroit prides itself on being tougher than the rest so it is going to take a brave soul to inform them that motor city is just an extension of cork city with more soul food and less hurling if yo chars,"['detroit', 'links', 'cork', 'hard', 'miss', 'city', 'subtle', 'swagger', 'self', 'assurance', 'detroit', 'prides', 'tougher', 'rest', 'going', 'take', 'brave', 'soul', 'inform', 'motor', 'city', 'extension', 'cork', 'city', 'soul', 'food', 'less', 'hurling', 'yo', 'chars']",,[]
Maureen Dowd: Where is the voice of authority to challenge Donald Trump on his morals?,Maureen Dowd,The Irish Times,Cardinal Timothy Dolan enabled the Republican presidential candidate to cast  himself as a saintly martyr saved by God,"The cardinal should go to confession.
Timothy Dolan let a white-tie charity dinner in New York showcase that most uncharitable of men, Donald Trump.
At the annual Al Smith dinner, Dolan suffused th… [+4899 chars]",20-10-2024,https://www.irishtimes.com/world/us/2024/10/20/maureen-dowd-where-is-the-voice-of-authority-to-challenge-donald-trump-on-his-morals/,https://www.irishtimes.com/resizer/v2/2VZV3LPJYKU5XVCMBYETIAETGE.jpg?smart=true&auth=edceecf8b0bb9da4b969fcfa390e393720d12a56fef676f4c060dfa0cb581059&width=1200&height=630,maureen dowd where is the voice of authority to challenge donald trump on his morals the cardinal should go to confession timothy dolan let a white tie charity dinner in new york showcase that most uncharitable of men donald trump at the annual al smith dinner dolan suffused th chars,"['maureen', 'dowd', 'voice', 'authority', 'challenge', 'donald', 'trump', 'morals', 'cardinal', 'go', 'confession', 'timothy', 'dolan', 'let', 'white', 'tie', 'charity', 'dinner', 'new', 'york', 'showcase', 'uncharitable', 'men', 'donald', 'trump', 'annual', 'al', 'smith', 'dinner', 'dolan', 'suffused', 'th', 'chars']",,[]
Former MTV host Ananda Lewis says she has stage-four breast cancer,Praveena Somasundaram,The Washington Post,Ananda Lewis shared details of her experience navigating treatment for breast cancer.,"In the days since the interview, Lewis has faced a wave of criticism about the decisions she made for her treatment. She told the Washington Post on Friday that despite the backlash, she doesnt regre… [+3710 chars]",20-10-2024,https://www.washingtonpost.com/nation/2024/10/18/ananda-lewis-breast-cancer/,https://www.nzherald.co.nz/resizer/v2/EHKZY5VHLVBGFNXVM2DRCL5ES4.jpg?auth=351b9c6e552ec5c774181691d20e7bc3234a5c18847ec7c16767d7aaa618c197&width=1200&height=675&quality=70&smart=true,former mtv host ananda lewis says she has stage four breast cancer in the days since the interview lewis has faced a wave of criticism about the decisions she made for her treatment she told the washington post on friday that despite the backlash she doesnt regre chars,"['former', 'mtv', 'host', 'ananda', 'lewis', 'says', 'stage', 'four', 'breast', 'cancer', 'days', 'since', 'interview', 'lewis', 'faced', 'wave', 'criticism', 'decisions', 'made', 'treatment', 'told', 'post', 'friday', 'despite', 'backlash', 'doesnt', 'regre', 'chars']",,[]
Semaglutide: What impact does it really have on heart health?,Robby Berman,Medical News Today,"A new meta-analysis confirms that semaglutide drugs like Ozempic are not only effective for weight loss, but can also protect the heart. However, certain doses and delivery systems can lead to side effects affecting the gut.","<ul><li>Diabetes medications based on semaglutide deliver important cardiovascular benefits, according to a new meta-analysis.</li><li>Untangling different health benefits resulting from semaglutide … [+7313 chars]",20-10-2024,https://www.medicalnewstoday.com/articles/semaglutide-boosts-heart-health-weight-loss-but-may-lead-to-gut-problems,https://media.post.rvohealth.io/wp-content/uploads/sites/3/2024/10/Semaglutide-heart-GettyImages-2153927815-Facebook.jpg,semaglutide what impact does it really have on heart health ul li diabetes medications based on semaglutide deliver important cardiovascular benefits according to a new meta analysis li li untangling different health benefits resulting from semaglutide chars,"['semaglutide', 'impact', 'really', 'heart', 'health', 'ul', 'li', 'diabetes', 'medications', 'based', 'semaglutide', 'deliver', 'important', 'cardiovascular', 'benefits', 'according', 'new', 'meta', 'analysis', 'li', 'li', 'untangling', 'different', 'health', 'benefits', 'resulting', 'semaglutide', 'chars']",,[]
"Musk Backs Paper Ballots For US Polls, Claims Voting Machines Rig Elections",Asian News International,NDTV News,"Elon Musk, the owner of X, while speaking at a town hall in the swing state of Pennsylvania, claimed that voting machines rig elections, ABC News reported.","Pennsylvania: Elon Musk, the owner of X, while speaking at a town hall in the swing state of Pennsylvania, claimed that voting machines rig elections, ABC News reported.
Musk is on a speaking tour a… [+2396 chars]",20-10-2024,https://www.ndtv.com/world-news/elon-musk-backs-paper-ballots-for-us-polls-claims-voting-machines-rig-elections-6829458,"https://c.ndtvimg.com/2024-09/jhsp7d2_elon-musk_625x300_21_September_24.jpeg?im=FeatureCrop,algorithm=dnn,width=1200,height=738",musk backs paper ballots for us polls claims voting machines rig elections pennsylvania elon musk the owner of x while speaking at a town hall in the swing state of pennsylvania claimed that voting machines rig elections abc news reported musk is on a speaking tour a chars,"['musk', 'backs', 'paper', 'ballots', 'us', 'polls', 'claims', 'voting', 'machines', 'rig', 'elections', 'pennsylvania', 'elon', 'musk', 'owner', 'x', 'speaking', 'town', 'hall', 'swing', 'state', 'pennsylvania', 'claimed', 'voting', 'machines', 'rig', 'elections', 'abc', 'news', 'reported', 'musk', 'speaking', 'tour', 'chars']",,[]
Boss Fires Woman After She Comes Back From Maternity Leave Pregnant Again,Ritu Singh,NDTV News,"Nikita Twitchen, a former admin assistant at First Grade Projects, launched an unfair dismissal claim, alleging her pregnancy was the reason for her termination.","A woman in the UK who was fired from her job when she came back from maternity leave pregnant again, has been awarded 28,000 pounds by an employment tribunal. Nikita Twitchen, a former admin assistan… [+2526 chars]",20-10-2024,https://www.ndtv.com/world-news/uk-woman-fired-after-coming-back-from-maternity-leave-pregnant-again-awarded-compensation-6830250,"https://c.ndtvimg.com/2024-08/atkj5em8_pregnant-woman_625x300_12_August_24.jpeg?im=FeatureCrop,algorithm=dnn,width=1200,height=738",boss fires woman after she comes back from maternity leave pregnant again a woman in the uk who was fired from her job when she came back from maternity leave pregnant again has been awarded pounds by an employment tribunal nikita twitchen a former admin assistan chars,"['boss', 'fires', 'woman', 'comes', 'back', 'maternity', 'leave', 'pregnant', 'woman', 'uk', 'fired', 'job', 'came', 'back', 'maternity', 'leave', 'pregnant', 'awarded', 'pounds', 'employment', 'tribunal', 'nikita', 'twitchen', 'former', 'admin', 'assistan', 'chars']",,[]
Juventus Squeeze Past 10-Man Lazio To Move Level With Leaders Napoli,Agence France-Presse,NDTV News,Juventus moved level on points with Serie A leaders Napoli on Saturday after squeezing past 10-man Lazio 1-0,"Juventus moved level on points with Serie A leaders Napoli on Saturday after squeezing past 10-man Lazio 1-0, while AC Milan overcame having to play for over an hour with 10 men to beat Udinese by th… [+3655 chars]",20-10-2024,https://sports.ndtv.com/football/juventus-squeeze-past-10-man-lazio-to-move-level-with-leaders-napoli-6829815,"https://c.ndtvimg.com/2024-10/l6mtb5vg_juventus-afp_625x300_20_October_24.jpg?im=FitAndFill,algorithm=dnn,width=1200,height=738",juventus squeeze past man lazio to move level with leaders napoli juventus moved level on points with serie a leaders napoli on saturday after squeezing past man lazio while ac milan overcame having to play for over an hour with men to beat udinese by th chars,"['juventus', 'squeeze', 'past', 'man', 'lazio', 'move', 'level', 'leaders', 'napoli', 'juventus', 'moved', 'level', 'points', 'serie', 'leaders', 'napoli', 'saturday', 'squeezing', 'past', 'man', 'lazio', 'ac', 'milan', 'overcame', 'play', 'hour', 'men', 'beat', 'udinese', 'th', 'chars']",,[]
Salman Khan On Returning To Bigg Boss 18 Set After Baba Siddique's Death,Hardika Gupta,NDTV News,"&quot;I feel that I shouldn&#039;t have come here. I didn&#039;t want to come, but this is a commitment, so I&#039;m here,&quot; Salman Khan said","New Delhi: Salman Khan has returned to Bigg Boss 18 just days after the brutal murder of his close friend and NCP leader Baba Siddique. In the latest episode, the actor expressed that he didn't want … [+3358 chars]",20-10-2024,https://www.ndtv.com/entertainment/salman-khan-on-returning-to-bigg-boss-18-set-after-baba-siddiques-death-what-all-im-going-through-6829955,https://c.ndtvimg.com/2024-10/irf5enbo_salman-khan_625x300_20_October_24.jpg,salman khan on returning to bigg boss set after baba siddique is death new delhi salman khan has returned to bigg boss just days after the brutal murder of his close friend and ncp leader baba siddique in the latest episode the actor expressed that he did not want chars,"['salman', 'khan', 'returning', 'bigg', 'boss', 'set', 'baba', 'siddique', 'death', 'new', 'delhi', 'salman', 'khan', 'returned', 'bigg', 'boss', 'days', 'brutal', 'murder', 'close', 'friend', 'ncp', 'leader', 'baba', 'siddique', 'latest', 'episode', 'actor', 'expressed', 'want', 'chars']",,[]
Zayn Malik Postpones US Tour After One Direction Member Liam Payne's Death,Hardika Gupta,NDTV News,"&quot;Given the heartbreaking loss experienced this week, I&#039;ve made the decision to postpone the US leg of the tour,&quot; wrote Zayn Malik","New Delhi: Zayn Malik has postponed the US leg of his upcoming tour Stairway To The Sky following the ""heartbreaking loss"" of his former One Direction bandmate, Liam Payne, who tragically died at the… [+3876 chars]",20-10-2024,https://www.ndtv.com/entertainment/zayn-malik-postpones-us-tour-after-one-direction-member-liam-paynes-death-given-the-heartbreaking-loss-6829744,https://c.ndtvimg.com/2024-10/jq5d9i3_z_625x300_20_October_24.jpeg,zayn malik postpones us tour after one direction member liam payne is death new delhi zayn malik has postponed the us leg of his upcoming tour stairway to the sky following the heartbreaking loss of his former one direction bandmate liam payne who tragically died at the chars,"['zayn', 'malik', 'postpones', 'us', 'tour', 'one', 'direction', 'member', 'liam', 'payne', 'death', 'new', 'delhi', 'zayn', 'malik', 'postponed', 'us', 'leg', 'upcoming', 'tour', 'stairway', 'sky', 'following', 'heartbreaking', 'loss', 'former', 'one', 'direction', 'bandmate', 'liam', 'payne', 'tragically', 'died', 'chars']",,[]
