title,author,source,description,content,pub_date,url,photo_url,combined_text,tokens,lems,keywords
State of the race: Five takeaways 17 days out from the US election,Al Jazeera Staff,Al Jazeera English,What's the latest on the race between Kamala Harris and Donald Trump? Al Jazeera breaks down the week's election news.,"Its been another whirlwind week in United States politics. And with just over two weeks left in the presidential race, the candidates are preparing to make their final appeals to voters.
What have K… [+7505 chars]",20-10-2024,https://www.aljazeera.com/news/2024/10/20/state-of-the-race-five-takeaways-seventeen-days-out-from-us-election,https://www.aljazeera.com/wp-content/uploads/2024/10/AP24294052018043-1729389427.jpg?resize=1920%2C1440,state of the race five takeaways days out from the us election its been another whirlwind week in united states politics and with just over two weeks left in the presidential race the candidates are preparing to make their final appeals to voters what have k chars,"['state', 'race', 'five', 'takeaways', 'days', 'us', 'election', 'another', 'whirlwind', 'week', 'united', 'states', 'politics', 'two', 'weeks', 'left', 'presidential', 'race', 'candidates', 'preparing', 'make', 'final', 'appeals', 'voters', 'k', 'chars']",,[]
LIVE: Huge Israeli strike kills more than 70 in north Gaza’s Beit Lahiya,Lyndal Rowlands,Al Jazeera English,Multiple air strikes on residential area in Beit Lahiya come amid punishing weeks-long Israeli siege of north Gaza.,"blinking-dot
Live updatesLive updates, 
Multiple air strikes on residential area in Beit Lahiya carried out amid punishing weeks-long Israeli military siege of northern Gaza.",20-10-2024,https://www.aljazeera.com/news/liveblog/2024/10/20/live-dozens-killed-in-israeli-attack-on-beit-lahiya-in-north-of-gaza,https://www.aljazeera.com/wp-content/uploads/2024/10/AA-20241019-35953060-35953058-ISRAELI_ATTACK_ON_MAGHAZI_REFUGEE_CAMP_IN_DEIR_ALBALAH-1729381680.jpg?resize=1200%2C630,live huge israeli strike kills more than in north gaza s beit lahiya blinking dot live updateslive updates multiple air strikes on residential area in beit lahiya carried out amid punishing weeks long israeli military siege of northern gaza,"['live', 'huge', 'israeli', 'strike', 'kills', 'north', 'gaza', 'beit', 'lahiya', 'blinking', 'dot', 'live', 'updateslive', 'updates', 'multiple', 'air', 'strikes', 'residential', 'area', 'beit', 'lahiya', 'carried', 'amid', 'punishing', 'weeks', 'long', 'israeli', 'military', 'siege', 'northern', 'gaza']",,[]
Caught at the helm,BBC World Service,BBC News,"Katy Fallon tells the story of the refugees and other migrants ensnared in Greece’s legal crossfire. Greek authorities routinely prosecute those found near the controls of boats carrying people trying to reach Europe, but human rights monitors assert that it …",Katy Fallon tells the story of the refugees and other migrants ensnared in Greeces legal crossfire. Greek authorities routinely prosecute those found near the controls of boats carrying people trying… [+543 chars],20-10-2024,https://www.bbc.co.uk/programmes/p0jy4mch,https://ichef.bbci.co.uk/images/ic/1200x675/p0css1dx.jpg,caught at the helm katy fallon tells the story of the refugees and other migrants ensnared in greeces legal crossfire greek authorities routinely prosecute those found near the controls of boats carrying people trying chars,"['caught', 'helm', 'katy', 'fallon', 'tells', 'story', 'refugees', 'migrants', 'ensnared', 'greeces', 'legal', 'crossfire', 'greek', 'authorities', 'routinely', 'prosecute', 'found', 'near', 'controls', 'boats', 'carrying', 'people', 'trying', 'chars']",,[]
Clocks to go back as autumn weather takes hold,Barra Best,BBC News,"At 02:00 BST on 27 October clocks will go back by one hour, providing an extra hour in bed for many.","The clock change is rooted in a century-old practice designed to make better use of daylight during the winter months.
By shifting an hour of sunlight from the evening to the morning, the goal is to… [+1145 chars]",20-10-2024,https://www.bbc.co.uk/news/articles/cm28gv44rz3o,https://ichef.bbci.co.uk/news/1024/branded_news/e41c/live/ec6d0a30-8afe-11ef-8dd9-115a8781b651.jpg,clocks to go back as autumn weather takes hold the clock change is rooted in a century old practice designed to make better use of daylight during the winter months by shifting an hour of sunlight from the evening to the morning the goal is to chars,"['clocks', 'go', 'back', 'autumn', 'weather', 'takes', 'hold', 'clock', 'change', 'rooted', 'century', 'old', 'practice', 'designed', 'make', 'better', 'use', 'daylight', 'winter', 'months', 'shifting', 'hour', 'sunlight', 'evening', 'morning', 'goal', 'chars']",,[]
Why are we building homes when so many are standing empty?,Brian Wheeler,BBC News,"Bringing empty homes back into use can be tricky, but campaigners say a lot more could be done to help.","In an average working day, Claudia Bowring has to play the role of detective, estate agent, family mediator and, occasionally, grief counsellor.
Shes an empty homes officer for a borough council in … [+1853 chars]",20-10-2024,https://www.bbc.co.uk/news/articles/c4g518le0r5o,https://ichef.bbci.co.uk/news/1024/branded_news/bb6b/live/80655fc0-8eca-11ef-8dd3-bb530ef3f124.jpg,why are we building homes when so many are standing empty in an average working day claudia bowring has to play the role of detective estate agent family mediator and occasionally grief counsellor shes an empty homes officer for a borough council in chars,"['building', 'homes', 'many', 'standing', 'empty', 'average', 'working', 'day', 'claudia', 'bowring', 'play', 'role', 'detective', 'estate', 'agent', 'family', 'mediator', 'occasionally', 'grief', 'counsellor', 'shes', 'empty', 'homes', 'officer', 'borough', 'council', 'chars']",,[]
Anglo-Saxon coin pendant found at Attleborough is 'very unusual',Katy Prickett,BBC News,"The Anglo-Saxons ""made the whole thing from scratch"" rather than reuse an old coin, says an expert.","Dr Marsden, from the Norfolk Historic Environment Service, external, said this was an era when the Roman Empire, which had become officially Christian by AD380, was ""in freefall"".
""We know the Anglo… [+871 chars]",20-10-2024,https://www.bbc.co.uk/news/articles/cvgxye0lrvjo,https://ichef.bbci.co.uk/news/1024/branded_news/7ca4/live/b59925b0-8c80-11ef-8936-1185f9e7d044.jpg,anglo saxon coin pendant found at attleborough is have ry unusual dr marsden from the norfolk historic environment service external said this was an era when the roman empire which had become officially christian by ad was in freefall we know the anglo chars,"['anglo', 'saxon', 'coin', 'pendant', 'found', 'attleborough', 'ry', 'unusual', 'dr', 'marsden', 'norfolk', 'historic', 'environment', 'service', 'external', 'said', 'era', 'roman', 'empire', 'become', 'officially', 'christian', 'ad', 'freefall', 'know', 'anglo', 'chars']",,[]
Lucy Letby: We spent years covering the case – here’s why experts are still arguing about it,Jonathan Coffey And Judith Moritz,BBC News,"For more than a year, we’ve been examining the scientific evidence and speaking to the experts at the centre of the case.","The medical condition of the babies also fitted with the lab results. In both cases, the babies blood sugar levels had plummeted, which is what you would expect to see with insulin poisoning. And whi… [+2087 chars]",20-10-2024,https://www.bbc.co.uk/news/articles/cvgwx9xprwqo,https://ichef.bbci.co.uk/news/1024/branded_news/d919/live/a27d4ec0-8d61-11ef-89ae-5575c76d98e6.png,lucy letby we spent years covering the case here s why experts are still arguing about it the medical condition of the babies also fitted with the lab results in both cases the babies blood sugar levels had plummeted which is what you would expect to see with insulin poisoning and whi chars,"['lucy', 'letby', 'spent', 'years', 'covering', 'case', 'experts', 'still', 'arguing', 'medical', 'condition', 'babies', 'also', 'fitted', 'lab', 'results', 'cases', 'babies', 'blood', 'sugar', 'levels', 'plummeted', 'would', 'expect', 'see', 'insulin', 'poisoning', 'whi', 'chars']",,[]
Stillbirth: 'Irish database means our son will not be forgotten',Eimear Flanagan,BBC News,An Irish mother whose eldest boy was stillborn hails the importance of a new public record of loss.,"In recent years much of the secrecy that once surrounded stillbirth and miscarriage has dissipated as more parents like Maria choose to speak out about baby loss. 
Those changing attitudes are also … [+1877 chars]",20-10-2024,https://www.bbc.co.uk/news/articles/c4gqlwvygdno,https://ichef.bbci.co.uk/news/1024/branded_news/9cc0/live/c5528c50-8c92-11ef-ab1d-79f5630c944f.jpg,stillbirth irish database means our son will not be forgotten in recent years much of the secrecy that once surrounded stillbirth and miscarriage has dissipated as more parents like maria choose to speak out about baby loss those changing attitudes are also chars,"['stillbirth', 'irish', 'database', 'means', 'son', 'forgotten', 'recent', 'years', 'much', 'secrecy', 'surrounded', 'stillbirth', 'miscarriage', 'dissipated', 'parents', 'like', 'maria', 'choose', 'speak', 'baby', 'loss', 'changing', 'attitudes', 'also', 'chars']",,[]
"HDB Financial Services to raise ₹12,500 via IPO",Bloomberg,Bloomberg,"The Mumbai-based bank’s board has approved its unit’s offer for sale of equity shares worth ₹10,000 crore held by the bank and ₹2,500 crore of new shares.","HDB Financial Services Ltd., a unit of Indias largest private sector lender, HDFC Bank Ltd. plans to raise as much as 12,500 crore ($1.5 billion) through an initial public offering (IPO), further add… [+1013 chars]",20-10-2024,https://www.bloomberg.com/news/articles/2024-10-19/hdfc-bank-approves-1-5-billion-ipo-of-unit-hdb-financial,https://bl-i.thgim.com/public/incoming/cbk19q/article68775022.ece/alternates/LANDSCAPE_1200/IMG_th17_BU_IPO_2_1_Q39A2CFN.jpg,hdb financial services to raise via ipo hdb financial services ltd a unit of indias largest private sector lender hdfc bank ltd plans to raise as much as crore billion through an initial public offering ipo further add chars,"['hdb', 'financial', 'services', 'raise', 'via', 'ipo', 'hdb', 'financial', 'services', 'ltd', 'unit', 'indias', 'largest', 'private', 'sector', 'lender', 'hdfc', 'bank', 'ltd', 'plans', 'raise', 'much', 'crore', 'billion', 'initial', 'public', 'offering', 'ipo', 'add', 'chars']",,[]
Roy Wood Jr. and comedians joke about viral gesture from Kamala Harris’ Fox News interview | CNN,,CNN,Roy Wood Jr. and comedians joke about viral gesture from Kamala Harris’ Fox News interview | CNNcnn.com,"Roy Wood Jr. asks comedians on ""Have I Got News For You' for their takes on the hand gesture Fox News anchors Brett Baier made during his interview of Vice President Kamala Harris. Watch CNNs new com… [+36 chars]",20-10-2024,https://www.cnn.com/2024/10/19/entertainment/video/kamala-harris-interview-fox-news-brett-baier-hand-gesture-hignfy-digvid,"https://media.cnn.com/api/v1/images/stellar/prod/20241019-hignfy-split.jpg?c=16x9&q=w_800,c_fill",roy wood jr and comedians joke about viral gesture from kamala harris fox news interview cnn roy wood jr asks comedians on have i got news for you for their takes on the hand gesture fox news anchors brett baier made during his interview of vice president kamala harris watch cnns new com chars,"['roy', 'wood', 'jr', 'comedians', 'joke', 'viral', 'gesture', 'kamala', 'harris', 'fox', 'news', 'interview', 'cnn', 'roy', 'wood', 'jr', 'asks', 'comedians', 'got', 'news', 'takes', 'hand', 'gesture', 'fox', 'news', 'anchors', 'brett', 'baier', 'made', 'interview', 'vice', 'president', 'kamala', 'harris', 'watch', 'cnns', 'new', 'com', 'chars']",,[]
Alec Baldwin returns to ‘SNL’ in the cold open… but not as Donald Trump | CNN,Alli Rosenbloom,CNN,"Alec Baldwin showed up again on the latest episode of “Saturday Night Live,” but not in his previous capacity impersonating former US President Donald Trump.","Alec Baldwin showed up again on the latest episode of Saturday Night Live, but not in his previous capacity impersonating former US President Donald Trump.
This time, Baldwin played FOX News anchor … [+1853 chars]",20-10-2024,https://www.cnn.com/2024/10/20/entertainment/alec-baldwin-snl/index.html,"https://media.cnn.com/api/v1/images/stellar/prod/still-21055740-214275-48200000002-still.jpg?c=16x9&q=w_800,c_fill",alec baldwin returns to snl in the cold open but not as donald trump cnn alec baldwin showed up again on the latest episode of saturday night live but not in his previous capacity impersonating former us president donald trump this time baldwin played fox news anchor chars,"['alec', 'baldwin', 'returns', 'snl', 'cold', 'open', 'donald', 'trump', 'cnn', 'alec', 'baldwin', 'showed', 'latest', 'episode', 'saturday', 'night', 'live', 'previous', 'capacity', 'impersonating', 'former', 'us', 'president', 'donald', 'trump', 'time', 'baldwin', 'played', 'fox', 'news', 'anchor', 'chars']",,[]
'Monsters' star Cooper Koch was told his 'gay voice' would hinder his career,Ryan Coleman,Entertainment Weekly,"Cooper Koch is a standout as Erik Menéndez in Netflix's 'Monsters,' but an acting teacher once told him his 'gay voice' would prevent him from booking roles.","One of the hardest things about being queer in Hollywood is everyone telling you how impossible it'll be to succeed in Hollywood if you're queer.
Cooper Koch, one of the breakout stars of Monsters: … [+3016 chars]",20-10-2024,https://ew.com/monsters-star-cooper-koch-acting-teacher-gay-voice-8728594,https://ew.com/thmb/UhN0TGpMqpsSjhbTbxUxWoh0tKQ=/1500x0/filters:no_upscale():max_bytes(150000):strip_icc()/Cooper-Koch-MONSTERS-101524-0eb459d5662d4152a0918d85c4642347.jpg,monsters star cooper koch was told his gay voice would hinder his career one of the hardest things about being queer in hollywood is everyone telling you how impossible it will be to succeed in hollywood if you are queer cooper koch one of the breakout stars of monsters chars,"['monsters', 'star', 'cooper', 'koch', 'told', 'gay', 'voice', 'would', 'hinder', 'career', 'one', 'hardest', 'things', 'queer', 'hollywood', 'everyone', 'telling', 'impossible', 'succeed', 'hollywood', 'queer', 'cooper', 'koch', 'one', 'breakout', 'stars', 'monsters', 'chars']",,[]
Trump says he overpowered an older Arnold Palmer in golf and reveals how golfers reacted to Palmer in shower,Jackson Thompson,Fox News,"Former President Trump claims to have competed against golf legend Arnold Palmer at his own game, but he had a notable age advantage.","Former President Trump claims to have competed against golf legend Arnold Palmer at his own game, but with a notable age advantage. 
Trump explained during a rally in Pennsylvania Saturday at Arnold… [+3566 chars]",20-10-2024,https://www.foxnews.com/sports/trump-says-he-overpowered-older-arnold-palmer-golf-reveals-how-golfers-reacted-him-shower,https://static.foxnews.com/foxnews.com/content/uploads/2024/10/trump-golf.jpg,trump says he overpowered an older arnold palmer in golf and reveals how golfers reacted to palmer in shower former president trump claims to have competed against golf legend arnold palmer at his own game but with a notable age advantage trump explained during a rally in pennsylvania saturday at arnold chars,"['trump', 'says', 'overpowered', 'older', 'arnold', 'palmer', 'golf', 'reveals', 'golfers', 'reacted', 'palmer', 'shower', 'former', 'president', 'trump', 'claims', 'competed', 'golf', 'legend', 'arnold', 'palmer', 'game', 'notable', 'age', 'advantage', 'trump', 'explained', 'rally', 'pennsylvania', 'saturday', 'arnold', 'chars']",,[]
"Harris recruits pop stars Usher, Lizzo for swing state pushes: 'It's going to be a tight race'",Brie Stimson,Fox News,Musicians Usher and Lizzo both stumped for Vice President Kamala Harris at separate rallies in Georgia and Michigan on Saturday with just 17 days left until the presidential election.,"Vice President Kamala Harris was joined by pop stars Usher and Lizzo at separate rallies in Georgia and Michigan, respectively, on Saturday, as the Democratic presidential nominee continued her push … [+2548 chars]",20-10-2024,https://www.foxnews.com/politics/harris-recruits-pop-stars-usher-lizzo-swing-state-pushes-tight-race,https://static.foxnews.com/foxnews.com/content/uploads/2024/10/usher-lizzo-kamala.jpg,harris recruits pop stars usher lizzo for swing state pushes it is going to be a tight race vice president kamala harris was joined by pop stars usher and lizzo at separate rallies in georgia and michigan respectively on saturday as the democratic presidential nominee continued her push chars,"['harris', 'recruits', 'pop', 'stars', 'usher', 'lizzo', 'swing', 'state', 'pushes', 'going', 'tight', 'race', 'vice', 'president', 'kamala', 'harris', 'joined', 'pop', 'stars', 'usher', 'lizzo', 'separate', 'rallies', 'georgia', 'michigan', 'respectively', 'saturday', 'democratic', 'presidential', 'nominee', 'continued', 'push', 'chars']",,[]
"Harris appears to agree with protester accusing Israel of genocide: ‘What he’s talking about, it’s real’",Sarah Rumpf-Whitten,Fox News,"Vice President Kamala Harris appeared to agree with an interrupting protester who accused Israel of genocide, saying, ""What he’s talking about, it’s real.""","Vice President Kamala Harris appeared to agree with an anti-Israel protester who accused the Jewish state of genocide during a campaign stop.
A video of the exchange during a campaign stop Thursday … [+2091 chars]",20-10-2024,https://www.foxnews.com/politics/harris-appears-agrees-protestor-accusing-israel-genocide-what-hes-talking-about-its-real,https://static.foxnews.com/foxnews.com/content/uploads/2024/10/b65df3d5-thumb1.jpg,harris appears to agree with protester accusing israel of genocide what he s talking about it s real vice president kamala harris appeared to agree with an anti israel protester who accused the jewish state of genocide during a campaign stop a video of the exchange during a campaign stop thursday chars,"['harris', 'appears', 'agree', 'protester', 'accusing', 'israel', 'genocide', 'talking', 'real', 'vice', 'president', 'kamala', 'harris', 'appeared', 'agree', 'anti', 'israel', 'protester', 'accused', 'jewish', 'state', 'genocide', 'campaign', 'stop', 'video', 'exchange', 'campaign', 'stop', 'thursday', 'chars']",,[]
Tennessee upsets Alabama in SEC thriller; second loss of season puts Crimson Tide's playoff hopes in jeopardy,Chantz Martin,Fox News,The Tennessee Volunteers and head coach Josh Heupel earned what many would consider a statement win on Saturday when they upset Alabama.,"The Southeastern Conference showdown between seventh-ranked Alabama and No. 11 Tennessee was one of the most anticipated games on the Week 8 college football slate. 
The matchup lived up to the hype… [+2288 chars]",20-10-2024,https://www.foxnews.com/sports/tennessee-upsets-alabama-sec-showdown-second-loss-season-puts-crimson-tides-playoff-hopes-jeopardy,https://static.foxnews.com/foxnews.com/content/uploads/2024/10/nico-iamaleava-tn.jpg,tennessee upsets alabama in sec thriller second loss of season puts crimson tide is playoff hopes in jeopardy the southeastern conference showdown between seventh ranked alabama and no tennessee was one of the most anticipated games on the week college football slate the matchup lived up to the hype chars,"['tennessee', 'upsets', 'alabama', 'sec', 'thriller', 'second', 'loss', 'season', 'puts', 'crimson', 'tide', 'playoff', 'hopes', 'jeopardy', 'southeastern', 'conference', 'showdown', 'seventh', 'ranked', 'alabama', 'tennessee', 'one', 'anticipated', 'games', 'week', 'college', 'football', 'slate', 'matchup', 'lived', 'hype', 'chars']",,[]
Steelers add security measures for Trump's attendance at game against Aaron Rodgers' Jets,Jackson Thompson,Fox News,The Pittsburgh Steelers released a statement Saturday announcing new security protocols and warning fans about potential delays with Trump planning to attend Sunday's game.,"With former President Trump planning to attend the Pittsburgh Steelers' game Sunday night, the team has made security upgrades. Trump will be there to watch Steelers quarterback Russell Wilson make h… [+2909 chars]",20-10-2024,https://www.foxnews.com/sports/steelers-add-security-measures-trumps-attendance-game-against-aaron-rodgers-jets,https://static.foxnews.com/foxnews.com/content/uploads/2024/10/acrisure-stadium-1.jpg,steelers add security measures for trump is attendance at game against aaron rodgers jets with former president trump planning to attend the pittsburgh steelers game sunday night the team has made security upgrades trump will be there to watch steelers quarterback russell wilson make h chars,"['steelers', 'add', 'security', 'measures', 'trump', 'attendance', 'game', 'aaron', 'rodgers', 'jets', 'former', 'president', 'trump', 'planning', 'attend', 'pittsburgh', 'steelers', 'game', 'sunday', 'night', 'team', 'made', 'security', 'upgrades', 'trump', 'watch', 'steelers', 'quarterback', 'russell', 'wilson', 'make', 'h', 'chars']",,[]
Juan Soto sends the Yankees to the World Series for the first time in 15 years,Jackson Thompson,Fox News,Juan Soto hit a three-run home run on Saturday to bring the American League pennant back to the Bronx for the first time since 2009.,"The New York Yankees are going to the World Series for the first time since Obama's first year in office. 
Juan Soto hit a three-run home run on Saturday to bring the American League pennant back to… [+3284 chars]",20-10-2024,https://www.foxnews.com/sports/juan-soto-sends-yankees-world-series-first-time-15-years,https://static.foxnews.com/foxnews.com/content/uploads/2024/10/yankees-ws.jpg,juan soto sends the yankees to the world series for the first time in years the new york yankees are going to the world series for the first time since obama is first year in office juan soto hit a three run home run on saturday to bring the american league pennant back to chars,"['juan', 'soto', 'sends', 'yankees', 'world', 'series', 'first', 'time', 'years', 'new', 'york', 'yankees', 'going', 'world', 'series', 'first', 'time', 'since', 'obama', 'first', 'year', 'office', 'juan', 'soto', 'hit', 'three', 'run', 'home', 'run', 'saturday', 'bring', 'american', 'league', 'pennant', 'back', 'chars']",,[]
"Shooting at Mississippi trail ride leaves 3 dead, 8 wounded: sheriff",Landon Mion,Fox News,"Three people were killed and eight others were wounded in a shooting at a trail ride party in Holmes County, Mississippi, following a school's homecoming football win.","Three people were killed and eight others were wounded in a shooting at a trail ride party in Holmes County, Mississippi, as they were celebrating a school's homecoming football win several hours aft… [+1184 chars]",20-10-2024,https://www.foxnews.com/us/shooting-mississippi-trail-ride-leaves-3-dead-8-wounded-sheriff,https://static.foxnews.com/foxnews.com/content/uploads/2021/01/Police-Siren-iStock-2.jpg,shooting at mississippi trail ride leaves dead wounded sheriff three people were killed and eight others were wounded in a shooting at a trail ride party in holmes county mississippi as they were celebrating a school is homecoming football win several hours aft chars,"['shooting', 'mississippi', 'trail', 'ride', 'leaves', 'dead', 'wounded', 'sheriff', 'three', 'people', 'killed', 'eight', 'others', 'wounded', 'shooting', 'trail', 'ride', 'party', 'holmes', 'county', 'mississippi', 'celebrating', 'school', 'homecoming', 'football', 'win', 'several', 'hours', 'aft', 'chars']",,[]
Deion Sanders accuses Obama of 'playing political games' by picking Arizona to beat Colorado,Jackson Thompson,Fox News,Colorado head coach Deion Sanders called out Barack Obama after the former president incorrectly predicted Arizona would beat Sanders' Colorado Buffaloes.,"Colorado head coach Deion Sanders says he likes Barack Obama, but he had to call the former president out this week. 
Obama picked the Arizona Wildcats to beat Sanders' Buffaloes in a game Saturday.… [+3894 chars]",20-10-2024,https://www.foxnews.com/sports/deion-sanders-accuses-obama-playing-politics-picking-arizona-beat-colorado,https://static.foxnews.com/foxnews.com/content/uploads/2024/09/UCF-Colorado-Deion-Sanders.jpg,deion sanders accuses obama of playing political games by picking arizona to beat colorado colorado head coach deion sanders says he likes barack obama but he had to call the former president out this week obama picked the arizona wildcats to beat sanders buffaloes in a game saturday chars,"['deion', 'sanders', 'accuses', 'obama', 'playing', 'political', 'games', 'picking', 'arizona', 'beat', 'colorado', 'colorado', 'head', 'coach', 'deion', 'sanders', 'says', 'likes', 'barack', 'obama', 'call', 'former', 'president', 'week', 'obama', 'picked', 'arizona', 'wildcats', 'beat', 'sanders', 'buffaloes', 'game', 'saturday', 'chars']",,[]
