title,author,source,description,content,pub_date,url,photo_url,combined_text,tokens,lems
"Shooting at Mississippi trail ride leaves 3 dead, 8 wounded: sheriff",Landon Mion,Fox News,"Three people were killed and eight others were wounded in a shooting at a trail ride party in Holmes County, Mississippi, following a school's homecoming football win.","Three people were killed and eight others were wounded in a shooting at a trail ride party in Holmes County, Mississippi, as they were celebrating a school's homecoming football win several hours aft… [+1184 chars]",2024-10-20,https://www.foxnews.com/us/shooting-mississippi-trail-ride-leaves-3-dead-8-wounded-sheriff,https://static.foxnews.com/foxnews.com/content/uploads/2021/01/Police-Siren-iStock-2.jpg,shooting at mississippi trail ride leaves  dead  wounded sheriff three people were killed and eight others were wounded in a shooting at a trail ride party in holmes county mississippi as they were celebrating a school is homecoming football win several hours aft  chars,"['shooting', 'mississippi', 'trail', 'ride', 'leaves', 'dead', 'wounded', 'sheriff', 'three', 'people', 'killed', 'eight', 'others', 'wounded', 'shooting', 'trail', 'ride', 'party', 'holmes', 'county', 'mississippi', 'celebrating', 'school', 'homecoming', 'football', 'win', 'several', 'hours', 'aft', 'chars']",shooting mississippi trail ride leaf dead wounded sheriff three people killed eight others wounded shooting trail ride party holmes county mississippi celebrating school homecoming football win several hour aft char
Deion Sanders accuses Obama of 'playing political games' by picking Arizona to beat Colorado,Jackson Thompson,Fox News,Colorado head coach Deion Sanders called out Barack Obama after the former president incorrectly predicted Arizona would beat Sanders' Colorado Buffaloes.,"Colorado head coach Deion Sanders says he likes Barack Obama, but he had to call the former president out this week. 
Obama picked the Arizona Wildcats to beat Sanders' Buffaloes in a game Saturday.… [+3894 chars]",2024-10-20,https://www.foxnews.com/sports/deion-sanders-accuses-obama-playing-politics-picking-arizona-beat-colorado,https://static.foxnews.com/foxnews.com/content/uploads/2024/09/UCF-Colorado-Deion-Sanders.jpg,deion sanders accuses obama of playing political games by picking arizona to beat colorado colorado head coach deion sanders says he likes barack obama but he had to call the former president out this week obama picked the arizona wildcats to beat sanders buffaloes in a game saturday  chars,"['deion', 'sanders', 'accuses', 'obama', 'playing', 'political', 'games', 'picking', 'arizona', 'beat', 'colorado', 'colorado', 'head', 'coach', 'deion', 'sanders', 'says', 'likes', 'barack', 'obama', 'call', 'former', 'president', 'week', 'obama', 'picked', 'arizona', 'wildcats', 'beat', 'sanders', 'buffaloes', 'game', 'saturday', 'chars']",deion sander accuses obama playing political game picking arizona beat colorado colorado head coach deion sander say like barack obama call former president week obama picked arizona wildcat beat sander buffalo game saturday char
Shirley MacLaine explains why she and Jack Nicholson never had an affair,Ashley Hume,Fox News,Shirley MacLaine claimed that she had affairs with all of her leading men except for Jack Nicholson and Jack Lemmon. MacLaine was in a 28-year open marriage.,"Shirley MacLaine shared candid details about her love life in her upcoming memoir.
The 90-year-old actress, who previously penned her best-selling 1983 autobiography ""Out on a Limb,"" will release he… [+2975 chars]",2024-10-20,https://www.foxnews.com/entertainment/shirley-maclaine-explains-why-she-jack-nicholson-never-had-affair,https://static.foxnews.com/foxnews.com/content/uploads/2024/10/jack_shirley.jpg,shirley maclaine explains why she and jack nicholson never had an affair shirley maclaine shared candid details about her love life in her upcoming memoir the  year old actress who previously penned her best selling  autobiography out on a limb will release he  chars,"['shirley', 'maclaine', 'explains', 'jack', 'nicholson', 'never', 'affair', 'shirley', 'maclaine', 'shared', 'candid', 'details', 'love', 'life', 'upcoming', 'memoir', 'year', 'old', 'actress', 'previously', 'penned', 'best', 'selling', 'autobiography', 'limb', 'release', 'chars']",shirley maclaine explains jack nicholson never affair shirley maclaine shared candid detail love life upcoming memoir year old actress previously penned best selling autobiography limb release char
"Hotel guest heard 'loud, violent scream' from Liam Payne's room before singer's death: report",Ashley Hume,Fox News,"A hotel guest staying at the CasaSur Palermo Hotel reportedly heard a ""really loud, violent scream"" coming from Liam Payne's room prior to the One Direction singer's death.","A guest staying at the CasaSur Palermo Hotel heard a ""really loud, violent scream"" coming from Liam Payne's room before the One Direction singer's death, according to a new report.
Payne died at the… [+4876 chars]",2024-10-20,https://www.foxnews.com/entertainment/hotel-guest-heard-loud-violent-scream-liam-paynes-room-before-singers-death,https://static.foxnews.com/foxnews.com/content/uploads/2024/10/liam2.jpg,hotel guest heard loud violent scream from liam payne is room before singer is death report a guest staying at the casasur palermo hotel heard a really loud violent scream coming from liam payne is room before the one direction singer is death according to a new report payne died at the  chars,"['hotel', 'guest', 'heard', 'loud', 'violent', 'scream', 'liam', 'payne', 'room', 'singer', 'death', 'report', 'guest', 'staying', 'casasur', 'palermo', 'hotel', 'heard', 'really', 'loud', 'violent', 'scream', 'coming', 'liam', 'payne', 'room', 'one', 'direction', 'singer', 'death', 'according', 'new', 'report', 'payne', 'died', 'chars']",hotel guest heard loud violent scream liam payne room singer death report guest staying casasur palermo hotel heard really loud violent scream coming liam payne room one direction singer death according new report payne died char
Romance scams on the rise as Americans look to dating apps for love: 5 tips to protect yourself,Christina Coulter,Fox News,"Almost 70,000 people fell victim to romance scams in 2022, according to the Federal Trade Commission. Experts told Fox News Digital how those dating online can protect themselves.","Join Fox News for access to this content
Plus special access to select articles and other premium content with your account - free of charge.
By entering your email and pushing continue, you are ag… [+7694 chars]",2024-10-20,https://www.foxnews.com/us/romance-scams-rise-americans-look-dating-apps-love-5-tips-protect-yourself,https://static.foxnews.com/foxnews.com/content/uploads/2024/10/romance-scams-rise-as-americans-look-to-dating-apps.jpg,romance scams on the rise as americans look to dating apps for love  tips to protect yourself join fox news for access to this content plus special access to select articles and other premium content with your account free of charge by entering your email and pushing continue you are ag  chars,"['romance', 'scams', 'rise', 'americans', 'look', 'dating', 'apps', 'love', 'tips', 'protect', 'join', 'fox', 'news', 'access', 'content', 'plus', 'special', 'access', 'select', 'articles', 'premium', 'content', 'account', 'free', 'charge', 'entering', 'email', 'pushing', 'continue', 'ag', 'chars']",romance scam rise american look dating apps love tip protect join fox news access content plus special access select article premium content account free charge entering email pushing continue ag char
Greek man convicted for sneaking onto neighbors' properties to smell their shoes,Landon Mion,Fox News,A Greek judge gave a man a suspended one-month prison sentence following his conviction for sneaking onto his neighbors' properties to smell their shoes.,"A man in Greece was given a suspended one-month prison sentence after his conviction for disturbing his neighbors by repeatedly sneaking onto their properties and smelling their shoes.
Addressing th… [+1224 chars]",2024-10-20,https://www.foxnews.com/world/greek-man-convicted-sneaking-onto-neighbors-properties-smell-shoes,https://static.foxnews.com/foxnews.com/content/uploads/2024/10/shoes.png,greek man convicted for sneaking onto neighbors properties to smell their shoes a man in greece was given a suspended one month prison sentence after his conviction for disturbing his neighbors by repeatedly sneaking onto their properties and smelling their shoes addressing th  chars,"['greek', 'man', 'convicted', 'sneaking', 'onto', 'neighbors', 'properties', 'smell', 'shoes', 'man', 'greece', 'given', 'suspended', 'one', 'month', 'prison', 'sentence', 'conviction', 'disturbing', 'neighbors', 'repeatedly', 'sneaking', 'onto', 'properties', 'smelling', 'shoes', 'addressing', 'th', 'chars']",greek man convicted sneaking onto neighbor property smell shoe man greece given suspended one month prison sentence conviction disturbing neighbor repeatedly sneaking onto property smelling shoe addressing th char
Pennsylvania woman sentenced to life for murders of 2 young children found hanging in home's basement,Landon Mion,Fox News,A Pennsylvania woman was sentenced to two life terms without parole after her convictions for killing her two young children who were found hanging in their basement in 2019.,A Pennsylvania woman was sentenced to two life terms without parole following her convictions for murdering her two young children who were found hanging in the basement of their home in September 20… [+2368 chars],2024-10-20,https://www.foxnews.com/us/pennsylvania-woman-sentenced-life-murders-2-young-children-found-hanging-homes-basement,https://static.foxnews.com/foxnews.com/content/uploads/2024/10/lisa-snyder.png,pennsylvania woman sentenced to life for murders of  young children found hanging in home is basement a pennsylvania woman was sentenced to two life terms without parole following her convictions for murdering her two young children who were found hanging in the basement of their home in september   chars,"['pennsylvania', 'woman', 'sentenced', 'life', 'murders', 'young', 'children', 'found', 'hanging', 'home', 'basement', 'pennsylvania', 'woman', 'sentenced', 'two', 'life', 'terms', 'without', 'parole', 'following', 'convictions', 'murdering', 'two', 'young', 'children', 'found', 'hanging', 'basement', 'home', 'september', 'chars']",pennsylvania woman sentenced life murder young child found hanging home basement pennsylvania woman sentenced two life term without parole following conviction murdering two young child found hanging basement home september char
Older Americans turn to marijuana for better sleep and pain relief: Here's what to know,Melissa Rudy,Fox News,A growing number of older adults are turning to the drug for a variety of reasons — but are the potential benefits worth the risk? Experts give their insights.,"While cannabis has historically been more popular with younger groups, a growing number of older adults are turning to the drug for a variety of reasons but are the potential benefits worth the risk?… [+6503 chars]",2024-10-20,https://www.foxnews.com/health/older-americans-turn-marijuana-better-sleep-pain-relief-heres-what-know,https://static.foxnews.com/foxnews.com/content/uploads/2024/10/older-woman-cannabis.jpg,older americans turn to marijuana for better sleep and pain relief here is what to know while cannabis has historically been more popular with younger groups a growing number of older adults are turning to the drug for a variety of reasons but are the potential benefits worth the risk  chars,"['older', 'americans', 'turn', 'marijuana', 'better', 'sleep', 'pain', 'relief', 'know', 'cannabis', 'historically', 'popular', 'younger', 'groups', 'growing', 'number', 'older', 'adults', 'turning', 'drug', 'variety', 'reasons', 'potential', 'benefits', 'worth', 'risk', 'chars']",older american turn marijuana better sleep pain relief know cannabis historically popular younger group growing number older adult turning drug variety reason potential benefit worth risk char
Lane Bryant massacre: Criminal profiler says arrest could come in 2008 murder of 5 in women's clothing store,Michael Ruiz,Fox News,Criminal profiler says he believes unsolved Lane Bryant massacre can be solved with new technology and the public's help tracking down gunman who killed five.,"Join Fox News for access to this content
Plus special access to select articles and other premium content with your account - free of charge.
By entering your email and pushing continue, you are ag… [+6073 chars]",2024-10-20,https://www.foxnews.com/us/lane-bryant-massacre-criminal-profiler-says-arrest-could-come-2008-murder-5-womens-clothing-store,https://static.foxnews.com/foxnews.com/content/uploads/2024/10/gettyimages-160407964-scaled-e1729260475548.jpg,lane bryant massacre criminal profiler says arrest could come in  murder of  in women is clothing store join fox news for access to this content plus special access to select articles and other premium content with your account free of charge by entering your email and pushing continue you are ag  chars,"['lane', 'bryant', 'massacre', 'criminal', 'profiler', 'says', 'arrest', 'could', 'come', 'murder', 'women', 'clothing', 'store', 'join', 'fox', 'news', 'access', 'content', 'plus', 'special', 'access', 'select', 'articles', 'premium', 'content', 'account', 'free', 'charge', 'entering', 'email', 'pushing', 'continue', 'ag', 'chars']",lane bryant massacre criminal profiler say arrest could come murder woman clothing store join fox news access content plus special access select article premium content account free charge entering email pushing continue ag char
Patriots rookie QB Drake Maye floats theory on why NFL fans in UK should support his team,Chantz Martin,Fox News,The rookie QB presented an argument which appeared to be directed at football fans based in the United Kingdom who might be on the fence about which NFL team they should back.,"The New England Patriots are the latest NFL team to make the trip across the Atlantic Ocean for a game in the United Kingdom.
At some point after the players arrive in London, they typically engage … [+2234 chars]",2024-10-20,https://www.foxnews.com/sports/patriots-rookie-qb-drake-maye-floats-theory-why-nfl-fans-uk-should-support-his-team,https://static.foxnews.com/foxnews.com/content/uploads/2024/06/drake-maye-pats.jpg,patriots rookie qb drake maye floats theory on why nfl fans in uk should support his team the new england patriots are the latest nfl team to make the trip across the atlantic ocean for a game in the united kingdom at some point after the players arrive in london they typically engage  chars,"['patriots', 'rookie', 'qb', 'drake', 'maye', 'floats', 'theory', 'nfl', 'fans', 'uk', 'support', 'team', 'new', 'england', 'patriots', 'latest', 'nfl', 'team', 'make', 'trip', 'across', 'atlantic', 'ocean', 'game', 'united', 'kingdom', 'point', 'players', 'arrive', 'london', 'typically', 'engage', 'chars']",patriot rookie qb drake maye float theory nfl fan uk support team new england patriot latest nfl team make trip across atlantic ocean game united kingdom point player arrive london typically engage char
"Balance of power: Helene could shift political winds toward Trump, North Carolina lawmakers say",Elizabeth Elkind,Fox News,"Two North Carolina officials are hopeful their state will see massive voter turnout despite the effects of Helene, and both suggested they think Donald Trump will win.","Join Fox News for access to this content
Plus special access to select articles and other premium content with your account - free of charge.
By entering your email and pushing continue, you are ag… [+4585 chars]",2024-10-20,https://www.foxnews.com/politics/balance-power-helene-could-shift-political-winds-toward-trump-north-carolina-lawmakers-say,https://static.foxnews.com/foxnews.com/content/uploads/2024/10/trump-north-carolina.jpg,balance of power helene could shift political winds toward trump north carolina lawmakers say join fox news for access to this content plus special access to select articles and other premium content with your account free of charge by entering your email and pushing continue you are ag  chars,"['balance', 'power', 'helene', 'could', 'shift', 'political', 'winds', 'toward', 'trump', 'north', 'carolina', 'lawmakers', 'say', 'join', 'fox', 'news', 'access', 'content', 'plus', 'special', 'access', 'select', 'articles', 'premium', 'content', 'account', 'free', 'charge', 'entering', 'email', 'pushing', 'continue', 'ag', 'chars']",balance power helene could shift political wind toward trump north carolina lawmaker say join fox news access content plus special access select article premium content account free charge entering email pushing continue ag char
"Ferry dock collapse on Sapelo Island kills 7 people, injures several others",Andrea Margolis,Fox News,Georgia officials are investigating after a freak ferry dock collapse on Sapelo Island killed at least seven people and injured an unknown number of others.,"At least seven people were killed in a freak accident Saturday, after the gangway of a ferry dock in Georgia collapsed, according to local authorities.
A portion of the Marsh Landing Dock on Sapelo … [+1906 chars]",2024-10-20,https://www.foxnews.com/us/least-7-people-killed-georgia-ferry-dock-collapse-officials,https://static.foxnews.com/foxnews.com/content/uploads/2024/10/screenshot-2024-10-19-201746.png,ferry dock collapse on sapelo island kills  people injures several others at least seven people were killed in a freak accident saturday after the gangway of a ferry dock in georgia collapsed according to local authorities a portion of the marsh landing dock on sapelo  chars,"['ferry', 'dock', 'collapse', 'sapelo', 'island', 'kills', 'people', 'injures', 'several', 'others', 'least', 'seven', 'people', 'killed', 'freak', 'accident', 'saturday', 'gangway', 'ferry', 'dock', 'georgia', 'collapsed', 'according', 'local', 'authorities', 'portion', 'marsh', 'landing', 'dock', 'sapelo', 'chars']",ferry dock collapse sapelo island kill people injures several others least seven people killed freak accident saturday gangway ferry dock georgia collapsed according local authority portion marsh landing dock sapelo char
"Trump asks Pennsylvania crowd, 'Are you better off now than you were four years ago?'",Jasmine Baehr,Fox News,"Former President Trump painted an optimistic, pro-manufacturing picture for a crowd attending his rally in Latrobe, Pennsylvania, Saturday, receiving the endorsement of local steelworkers.","Former President Trump echoed Ronald Reagan on Saturday during a spirited battleground outdoor rally at Arnold Palmer Regional Airport in Latrobe, Pennsylvania, asking, ""Are you better off now than y… [+4399 chars]",2024-10-20,https://www.foxnews.com/politics/trump-asks-pennsylvania-crowd-are-you-better-off-now-than-you-were-four-years-ago,https://static.foxnews.com/foxnews.com/content/uploads/2024/10/trump-rally-latrobe.jpg,trump asks pennsylvania crowd are you better off now than you were four years ago former president trump echoed ronald reagan on saturday during a spirited battleground outdoor rally at arnold palmer regional airport in latrobe pennsylvania asking are you better off now than y  chars,"['trump', 'asks', 'pennsylvania', 'crowd', 'better', 'four', 'years', 'ago', 'former', 'president', 'trump', 'echoed', 'ronald', 'reagan', 'saturday', 'spirited', 'battleground', 'outdoor', 'rally', 'arnold', 'palmer', 'regional', 'airport', 'latrobe', 'pennsylvania', 'asking', 'better', 'chars']",trump asks pennsylvania crowd better four year ago former president trump echoed ronald reagan saturday spirited battleground outdoor rally arnold palmer regional airport latrobe pennsylvania asking better char
No. 22 Illinois beats No. 24 Michigan 21-7 for its first win over the Wolverines since 2009,By STEVE STEIN - Associated Press,Associated Press,"Luke Altmyer threw for a touchdown and ran for another, leading No. 22 Illinois to a 21-7 victory over No. 24 Michigan. Tanner Arkin caught a 2-yard touchdown pass from Altmyer in the second quarter and raced 36 yards on…","By STEVE STEIN - Associated Press
CHAMPAIGN, Ill. (AP) Luke Altmyer threw for a touchdown and ran for another, leading No. 22 Illinois to a 21-7 victory over No. 24 Michigan on Saturday.
Tanner Ark… [+2445 chars]",2024-10-20,https://apnews.com/article/illinois-michigan-football-score-2d3607edb207097979ed3dde29d82b93,https://bloximages.newyork1.vip.townnews.com/stltoday.com/content/tncms/assets/v3/editorial/d/ee/deecea27-b31d-5808-a212-018aaf2651a4/6714462e018de.image.jpg?crop=1763%2C926%2C0%2C124&resize=1200%2C630&order=crop%2Cresize,no  illinois beats no  michigan   for its first win over the wolverines since  by steve stein associated press champaign ill luke altmyer threw for a touchdown and ran for another leading no  illinois to a   victory over no  michigan on saturday tanner ark  chars,"['illinois', 'beats', 'michigan', 'first', 'win', 'wolverines', 'since', 'steve', 'stein', 'associated', 'press', 'champaign', 'ill', 'luke', 'altmyer', 'threw', 'touchdown', 'ran', 'another', 'leading', 'illinois', 'victory', 'michigan', 'saturday', 'tanner', 'ark', 'chars']",illinois beat michigan first win wolverine since steve stein associated press champaign ill luke altmyer threw touchdown ran another leading illinois victory michigan saturday tanner ark char
‘I Would Rather Be Kamala Harris Than I Would Donald Trump’,Gabriel Debenedetti,New York Magazine,"Jim Messina managed Barack Obama’s re-election campaign and is wired into the Kamala Harris effort against Donald Trump. He sees 2024 coming down to how women, especially white-working class women, vote in the first presidential election since Dobbs.","When Joe Bidens top political aides started setting up his campaign early last year, Jim Messina was one of their first calls. Messina, who managed Barack Obamas re-election campaign, had plenty of t… [+13891 chars]",2024-10-20,http://nymag.com/intelligencer/article/jim-messina-trump-harris-election-women.html,https://pyxis.nymag.com/v1/imgs/6f7/6c6/26dd131648903cc0465bd125546fd16f12-Jim-Messina.1x.rsocial.w1200.jpg,i would rather be kamala harris than i would donald trump when joe bidens top political aides started setting up his campaign early last year jim messina was one of their first calls messina who managed barack obamas re election campaign had plenty of t  chars,"['would', 'rather', 'kamala', 'harris', 'would', 'donald', 'trump', 'joe', 'bidens', 'top', 'political', 'aides', 'started', 'setting', 'campaign', 'early', 'last', 'year', 'jim', 'messina', 'one', 'first', 'calls', 'messina', 'managed', 'barack', 'obamas', 'election', 'campaign', 'plenty', 'chars']",would rather kamala harris would donald trump joe bidens top political aide started setting campaign early last year jim messina one first call messina managed barack obamas election campaign plenty char
‘I‘m falling in love with a man who’s just out of a 12-year relationship - and still lives with his ex’,Roe McDermott,The Irish Times,Ask Roe: ‘Do you think I’m crazy to get involved with someone so fresh out of a relationship with so much baggage?’,"Dear Roe,
Im 55 years old and have been on my own for about five years, while I was bringing up my daughter, and decided it was time to try dating again. I went on to Tinder and met this really nice… [+6759 chars]",2024-10-20,https://www.irishtimes.com/health/your-wellness/2024/10/20/im-falling-in-love-with-a-man-whos-just-out-of-a-12-year-relationship-and-still-lives-with-his-ex/,https://www.irishtimes.com/resizer/v2/F6AGWSAEINGB5PNUPS7ERWNW3M.jpg?smart=true&auth=521b55a7e2262bf95120fa99a795421289fbfcc5ba9729635aad606a6b909e29&width=1200&height=630,i m falling in love with a man who s just out of a  year relationship and still lives with his ex dear roe im  years old and have been on my own for about five years while i was bringing up my daughter and decided it was time to try dating again i went on to tinder and met this really nice  chars,"['falling', 'love', 'man', 'year', 'relationship', 'still', 'lives', 'ex', 'dear', 'roe', 'im', 'years', 'old', 'five', 'years', 'bringing', 'daughter', 'decided', 'time', 'try', 'dating', 'went', 'tinder', 'met', 'really', 'nice', 'chars']",falling love man year relationship still life ex dear roe im year old five year bringing daughter decided time try dating went tinder met really nice char
