title,author,source,description,content,pub_date,url,photo_url,combined_text,tokens,lems
Salman Khan On Returning To Bigg Boss 18 Set After Baba Siddique's Death,Hardika Gupta,NDTV News,"&quot;I feel that I shouldn&#039;t have come here. I didn&#039;t want to come, but this is a commitment, so I&#039;m here,&quot; Salman Khan said","New Delhi: Salman Khan has returned to Bigg Boss 18 just days after the brutal murder of his close friend and NCP leader Baba Siddique. In the latest episode, the actor expressed that he didn't want … [+3358 chars]",2024-10-20,https://www.ndtv.com/entertainment/salman-khan-on-returning-to-bigg-boss-18-set-after-baba-siddiques-death-what-all-im-going-through-6829955,https://c.ndtvimg.com/2024-10/irf5enbo_salman-khan_625x300_20_October_24.jpg,salman khan on returning to bigg boss  set after baba siddique is death new delhi salman khan has returned to bigg boss  just days after the brutal murder of his close friend and ncp leader baba siddique in the latest episode the actor expressed that he did not want  chars,"['salman', 'khan', 'returning', 'bigg', 'boss', 'set', 'baba', 'siddique', 'death', 'new', 'delhi', 'salman', 'khan', 'returned', 'bigg', 'boss', 'days', 'brutal', 'murder', 'close', 'friend', 'ncp', 'leader', 'baba', 'siddique', 'latest', 'episode', 'actor', 'expressed', 'want', 'chars']",salman khan returning bigg bos set baba siddique death new delhi salman khan returned bigg bos day brutal murder close friend ncp leader baba siddique latest episode actor expressed want char
Zayn Malik Postpones US Tour After One Direction Member Liam Payne's Death,Hardika Gupta,NDTV News,"&quot;Given the heartbreaking loss experienced this week, I&#039;ve made the decision to postpone the US leg of the tour,&quot; wrote Zayn Malik","New Delhi: Zayn Malik has postponed the US leg of his upcoming tour Stairway To The Sky following the ""heartbreaking loss"" of his former One Direction bandmate, Liam Payne, who tragically died at the… [+3876 chars]",2024-10-20,https://www.ndtv.com/entertainment/zayn-malik-postpones-us-tour-after-one-direction-member-liam-paynes-death-given-the-heartbreaking-loss-6829744,https://c.ndtvimg.com/2024-10/jq5d9i3_z_625x300_20_October_24.jpeg,zayn malik postpones us tour after one direction member liam payne is death new delhi zayn malik has postponed the us leg of his upcoming tour stairway to the sky following the heartbreaking loss of his former one direction bandmate liam payne who tragically died at the  chars,"['zayn', 'malik', 'postpones', 'us', 'tour', 'one', 'direction', 'member', 'liam', 'payne', 'death', 'new', 'delhi', 'zayn', 'malik', 'postponed', 'us', 'leg', 'upcoming', 'tour', 'stairway', 'sky', 'following', 'heartbreaking', 'loss', 'former', 'one', 'direction', 'bandmate', 'liam', 'payne', 'tragically', 'died', 'chars']",zayn malik postpones u tour one direction member liam payne death new delhi zayn malik postponed u leg upcoming tour stairway sky following heartbreaking loss former one direction bandmate liam payne tragically died char
Israel Hits Hezbollah Intelligence HQ After Drone Launched At Netanyahu Home,Agence France-Presse,NDTV News,The strikes on Hezbollah&#039;s south Beirut stronghold came after Benjamin Netanyahu accused the Iran-backed group of attempting to assassinate him by targeting his residence.,"Fighting raged on two fronts Sunday as Israel targeted what it said was a Hezbollah ""command centre"" in the Lebanese capital, while in Gaza rescuers reported 73 people killed in a single air strike. … [+5074 chars]",2024-10-20,https://www.ndtv.com/world-news/israel-hits-hezbollah-intelligence-hq-hamas-in-gaza-after-drone-launched-at-benjamin-netanyahu-home-6831469,https://c.ndtvimg.com/2024-10/e19edqto_israel-hezbollah_625x300_20_October_24.jpeg,israel hits hezbollah intelligence hq after drone launched at netanyahu home fighting raged on two fronts sunday as israel targeted what it said was a hezbollah command centre in the lebanese capital while in gaza rescuers reported  people killed in a single air strike  chars,"['israel', 'hits', 'hezbollah', 'intelligence', 'hq', 'drone', 'launched', 'netanyahu', 'home', 'fighting', 'raged', 'two', 'fronts', 'sunday', 'israel', 'targeted', 'said', 'hezbollah', 'command', 'centre', 'lebanese', 'capital', 'gaza', 'rescuers', 'reported', 'people', 'killed', 'single', 'air', 'strike', 'chars']",israel hit hezbollah intelligence hq drone launched netanyahu home fighting raged two front sunday israel targeted said hezbollah command centre lebanese capital gaza rescuer reported people killed single air strike char
"""Didn't Have A Lot To Share"": Iqbal Khan On His Instagram Comeback",Madhumanti Pait Chowdhury,NDTV News,"&quot;I just want it to be chill and not worry about increasing my followers and keeping up with the algo,&quot; Iqbal Khan said","New Delhi: Iqbal Khan, who rose to fame with Ektaa Kapoor's cult show Kaisa Ye Pyar Hai, made a comeback on Instagram after a three and half years break last week. In an age of followers and social m… [+1765 chars]",2024-10-20,https://www.ndtv.com/entertainment/iqbal-khan-makes-a-comeback-on-instagram-after-3-5-years-i-didnt-have-a-lot-to-share-6831351,https://c.ndtvimg.com/2024-10/55ar6lg_iqbal-_625x300_20_October_24.jpeg,did not have a lot to share iqbal khan on his instagram comeback new delhi iqbal khan who rose to fame with ektaa kapoor is cult show kaisa ye pyar hai made a comeback on instagram after a three and half years break last week in an age of followers and social m  chars,"['lot', 'share', 'iqbal', 'khan', 'instagram', 'comeback', 'new', 'delhi', 'iqbal', 'khan', 'rose', 'fame', 'ektaa', 'kapoor', 'cult', 'show', 'kaisa', 'ye', 'pyar', 'hai', 'made', 'comeback', 'instagram', 'three', 'half', 'years', 'break', 'last', 'week', 'age', 'followers', 'social', 'chars']",lot share iqbal khan instagram comeback new delhi iqbal khan rose fame ektaa kapoor cult show kaisa ye pyar hai made comeback instagram three half year break last week age follower social char
Elon Musk To Award $1 Million Each Day To A Signer Of His Petition,Reuters,NDTV News,Elon Musk awarded a $1 million check to an attendee of his event in Pennsylvania aimed at rallying supporters behind Republican Donald Trump.,"Billionaire Elon Musk promised on Saturday to give away $1 million each day until November's election to someone who signs his online petition supporting the U.S. Constitution. And he wasted no time,… [+2455 chars]",2024-10-20,https://www.ndtv.com/world-news/elon-musk-to-award-1-million-each-day-to-a-signer-of-his-petition-6830305,https://c.ndtvimg.com/2024-10/9ku21jdo_elon-musk_625x300_20_October_24.jpeg,elon musk to award  million each day to a signer of his petition billionaire elon musk promised on saturday to give away  million each day until november is election to someone who signs his online petition supporting the u s constitution and he wasted no time  chars,"['elon', 'musk', 'award', 'million', 'day', 'signer', 'petition', 'billionaire', 'elon', 'musk', 'promised', 'saturday', 'give', 'away', 'million', 'day', 'november', 'election', 'someone', 'signs', 'online', 'petition', 'supporting', 'constitution', 'wasted', 'time', 'chars']",elon musk award million day signer petition billionaire elon musk promised saturday give away million day november election someone sign online petition supporting constitution wasted time char
"When Govinda ""Mercilessly"" Compared Wife Sunita With Neelam Kothari",Sreetama Basu,NDTV News,"In an old interview, Govinda shared how his love for Neelam would irritate his wife Sunita","Govinda and his wife Sunita have been married for over 40 years now. Sunita married the superstar when she was just 18 years old, and they have two children together - Tina Ahuja and Yashvardhan Ahuj… [+1684 chars]",2024-10-20,https://www.ndtv.com/entertainment/when-govinda-mercilessly-compared-wife-sunita-with-neelam-kothari-would-tell-her-to-learn-from-her-6831107,"https://c.ndtvimg.com/2024-10/71dj2g2g_s_625x300_20_October_24.jpg?im=FeatureCrop,algorithm=dnn,width=1200,height=738",when govinda mercilessly compared wife sunita with neelam kothari govinda and his wife sunita have been married for over  years now sunita married the superstar when she was just  years old and they have two children together tina ahuja and yashvardhan ahuj  chars,"['govinda', 'mercilessly', 'compared', 'wife', 'sunita', 'neelam', 'kothari', 'govinda', 'wife', 'sunita', 'married', 'years', 'sunita', 'married', 'superstar', 'years', 'old', 'two', 'children', 'together', 'tina', 'ahuja', 'yashvardhan', 'ahuj', 'chars']",govinda mercilessly compared wife sunita neelam kothari govinda wife sunita married year sunita married superstar year old two child together tina ahuja yashvardhan ahuj char
Kichcha Sudeep's Mother Saroja Sanjeev Dies At 86,Asian News International,NDTV News,Kichcha Sudeep&#039;s mother&#039;s last rites will take place in the city today at her residence in JP Nagar,"Bengaluru (Karnataka): Kannada actor Kichcha Sudeep's mother Saroja Sanjeev died after battling age-related ailments on Sunday morning. She breathed her last at Apollo Hospital, Jayanagar, where she … [+865 chars]",2024-10-20,https://www.ndtv.com/entertainment/kichcha-sudeeps-mother-saroja-sanjeev-passes-away-6831042,https://c.ndtvimg.com/2024-10/fog059s8_s_625x300_20_October_24.jpeg,kichcha sudeep is mother saroja sanjeev dies at  bengaluru karnataka kannada actor kichcha sudeep is mother saroja sanjeev died after battling age related ailments on sunday morning she breathed her last at apollo hospital jayanagar where she  chars,"['kichcha', 'sudeep', 'mother', 'saroja', 'sanjeev', 'dies', 'bengaluru', 'karnataka', 'kannada', 'actor', 'kichcha', 'sudeep', 'mother', 'saroja', 'sanjeev', 'died', 'battling', 'age', 'related', 'ailments', 'sunday', 'morning', 'breathed', 'last', 'apollo', 'hospital', 'jayanagar', 'chars']",kichcha sudeep mother saroja sanjeev dy bengaluru karnataka kannada actor kichcha sudeep mother saroja sanjeev died battling age related ailment sunday morning breathed last apollo hospital jayanagar char
Kamala Harris Turns 60 As Age Plays Key Role In US Election,Agence France-Presse,NDTV News,"Age has been a crucial factor in a campaign that Joe Biden quit over fears about his capacity, and where Kamala Harris has steadily taken aim at Donald Trump&#039;s mental fitness for office.","Atlanta: Kamala Harris turns 60 on Sunday in the final stretch of a knife-edge election battle with 78-year-old Donald Trump, who is now the oldest presidential candidate in US history. Age has been … [+2742 chars]",2024-10-20,https://www.ndtv.com/world-news/kamala-harris-turns-60-as-age-plays-key-role-in-2024-us-presidential-election-6830910,https://c.ndtvimg.com/2024-10/2lvn0a4_kamala-harris_625x300_20_October_24.jpeg,kamala harris turns  as age plays key role in us election atlanta kamala harris turns  on sunday in the final stretch of a knife edge election battle with  year old donald trump who is now the oldest presidential candidate in us history age has been  chars,"['kamala', 'harris', 'turns', 'age', 'plays', 'key', 'role', 'us', 'election', 'atlanta', 'kamala', 'harris', 'turns', 'sunday', 'final', 'stretch', 'knife', 'edge', 'election', 'battle', 'year', 'old', 'donald', 'trump', 'oldest', 'presidential', 'candidate', 'us', 'history', 'age', 'chars']",kamala harris turn age play key role u election atlanta kamala harris turn sunday final stretch knife edge election battle year old donald trump oldest presidential candidate u history age char
Karwa Chauth 2024: Sonam And Others Share Glimpses Of Their Festivities,NDTV Movies News Desk,NDTV News,"Sonam Kapoor, Parineeti Chopra And Shilpa Shetty are getting ready to celebrate Karwa Chauth and have shared some BTS pics from the preparations","First of all, let us take a moment to wish everyone a Happy Karwa Chauth. On this special festival, married women fast for the longevity of their husbands. They begin their day with a pre-dawn meal k… [+1539 chars]",2024-10-20,https://www.ndtv.com/entertainment/karwa-chauth-2024-check-out-posts-by-sonam-kapoor-parineeti-chopra-and-shilpa-shetty-6830497,"https://c.ndtvimg.com/2024-10/2pobupl_d_625x300_20_October_24.jpg?im=FeatureCrop,algorithm=dnn,width=1200,height=738",karwa chauth  sonam and others share glimpses of their festivities first of all let us take a moment to wish everyone a happy karwa chauth on this special festival married women fast for the longevity of their husbands they begin their day with a pre dawn meal k  chars,"['karwa', 'chauth', 'sonam', 'others', 'share', 'glimpses', 'festivities', 'first', 'let', 'us', 'take', 'moment', 'wish', 'everyone', 'happy', 'karwa', 'chauth', 'special', 'festival', 'married', 'women', 'fast', 'longevity', 'husbands', 'begin', 'day', 'pre', 'dawn', 'meal', 'k', 'chars']",karwa chauth sonam others share glimpse festivity first let u take moment wish everyone happy karwa chauth special festival married woman fast longevity husband begin day pre dawn meal k char
Vasan Bala Deactivates X Account After Being Trolled For Jigra's Failure,Madhumanti Pait Chowdhury,NDTV News,Alia Bhatt&#039;s Jigra earned an estimated ₹ 23.60 Cr in eight days of its release,New Delhi: Jigra director Vasan Bala deleted his X  (formerly known as Twitter) account days after he received hatred for defending the film though it failed to rake money at the box office. Vasan Ba… [+1557 chars],2024-10-20,https://www.ndtv.com/entertainment/director-vasan-bala-deactivates-twitter-after-being-trolled-for-jigras-box-office-failure-6831002,https://c.ndtvimg.com/2024-10/efictsqo_alia-bhatt-_625x300_20_October_24.jpeg,vasan bala deactivates x account after being trolled for jigra is failure new delhi jigra director vasan bala deleted his x formerly known as twitter account days after he received hatred for defending the film though it failed to rake money at the box office vasan ba  chars,"['vasan', 'bala', 'deactivates', 'x', 'account', 'trolled', 'jigra', 'failure', 'new', 'delhi', 'jigra', 'director', 'vasan', 'bala', 'deleted', 'x', 'formerly', 'known', 'twitter', 'account', 'days', 'received', 'hatred', 'defending', 'film', 'though', 'failed', 'rake', 'money', 'box', 'office', 'vasan', 'ba', 'chars']",vasan bala deactivates x account trolled jigra failure new delhi jigra director vasan bala deleted x formerly known twitter account day received hatred defending film though failed rake money box office vasan ba char
"1st Test: Young, Rachin Star In NZ's First Test Win In India Since 1988",Indo-Asian News Service,NDTV News,"When New Zealand arrived for their three-match Test series against India, many didn't give them a realistic chance to win even one game.","When New Zealand arrived for their three-match Test series against India, many didn't give them a realistic chance to win even one game. But outstanding performances with bat and ball, as well as sei… [+2734 chars]",2024-10-20,https://sports.ndtv.com/india-vs-new-zealand-2024/1st-test-will-young-rachin-ravindra-star-in-new-zealands-first-test-win-in-india-since-1988-6830865,"https://c.ndtvimg.com/2024-10/abb2li3g_will-young-bcci_625x300_20_October_24.jpg?im=FeatureCrop,algorithm=dnn,width=1200,height=738",st test young rachin star in nz is first test win in india since  when new zealand arrived for their three match test series against india many did not give them a realistic chance to win even one game but outstanding performances with bat and ball as well as sei  chars,"['st', 'test', 'young', 'rachin', 'star', 'nz', 'first', 'test', 'win', 'india', 'since', 'new', 'zealand', 'arrived', 'three', 'match', 'test', 'series', 'india', 'many', 'give', 'realistic', 'chance', 'win', 'even', 'one', 'game', 'outstanding', 'performances', 'bat', 'ball', 'well', 'sei', 'chars']",st test young rachin star nz first test win india since new zealand arrived three match test series india many give realistic chance win even one game outstanding performance bat ball well sei char
"""29 Years To The OG"": Kajol Shares LOL Post With SRK On Karwa Chauth",Sreetama Basu,NDTV News,"Sharing a still from Dilwale Dulhania Le Jayenge with Shah Rukh Khan, she reminded fans who the OG of Karwa Chauth is","As the whole of Bollywood is getting ready to celebrate Karwa Chauth celebrations in style, Kajol shared a light moment on Instagram. Sharing a still from her superhit 1995 film Dilwale Dulhania Le J… [+1686 chars]",2024-10-20,https://www.ndtv.com/entertainment/kajols-lol-karwa-chauth-post-with-shah-rukh-khan-is-so-worth-the-wait-29-years-to-the-og-6830588,"https://c.ndtvimg.com/2024-10/h6fqtr7o_d_625x300_20_October_24.jpeg?im=FeatureCrop,algorithm=dnn,width=1200,height=738",years to the og kajol shares lol post with srk on karwa chauth as the whole of bollywood is getting ready to celebrate karwa chauth celebrations in style kajol shared a light moment on instagram sharing a still from her superhit  film dilwale dulhania le j  chars,"['years', 'og', 'kajol', 'shares', 'lol', 'post', 'srk', 'karwa', 'chauth', 'whole', 'bollywood', 'getting', 'ready', 'celebrate', 'karwa', 'chauth', 'celebrations', 'style', 'kajol', 'shared', 'light', 'moment', 'instagram', 'sharing', 'still', 'superhit', 'film', 'dilwale', 'dulhania', 'le', 'j', 'chars']",year og kajol share lol post srk karwa chauth whole bollywood getting ready celebrate karwa chauth celebration style kajol shared light moment instagram sharing still superhit film dilwale dulhania le j char
CLAT 2025 Question Format For UG And PG Courses,Puniti Pandey,NDTV News,The entrance exam is conducted for admission to undergraduate and postgraduate law courses offered by 22 NLUs and other participating institutes.,New Delhi: Registrations are underway for the Common Law Admission Test (CLAT) 2025. Interested and eligible candidates who wish to appear in the law entrance exam can visit the official website of C… [+1527 chars],2024-10-20,https://www.ndtv.com/education/clat-2025-question-format-for-ug-and-pg-courses-6830631,"https://c.ndtvimg.com/2024-09/70fijemo_family-court-_625x300_25_September_24.jpg?im=FeatureCrop,algorithm=dnn,width=1200,height=738",clat  question format for ug and pg courses new delhi registrations are underway for the common law admission test clat  interested and eligible candidates who wish to appear in the law entrance exam can visit the official website of c  chars,"['clat', 'question', 'format', 'ug', 'pg', 'courses', 'new', 'delhi', 'registrations', 'underway', 'common', 'law', 'admission', 'test', 'clat', 'interested', 'eligible', 'candidates', 'wish', 'appear', 'law', 'entrance', 'exam', 'visit', 'official', 'website', 'c', 'chars']",clat question format ug pg course new delhi registration underway common law admission test clat interested eligible candidate wish appear law entrance exam visit official website c char
India's Sensational 36-Year Streak Ends With Massive Loss vs New Zealand,Press Trust of India,NDTV News,"New Zealand recorded their first Test victory on Indian soil after 36 years, beating the hosts by eight wickets on the fifth and final day of the opening encounter.","New Zealand survived a hostile Jasprit Bumrah spell to foil India's attempt to add a final-day twist to an absorbing series-opener, slaying the cricketing giants at home by eight wickets and ending a… [+4030 chars]",2024-10-20,https://sports.ndtv.com/india-vs-new-zealand-2024/indias-sensational-36-year-streak-ends-with-massive-loss-vs-new-zealand-6830804,"https://c.ndtvimg.com/2024-10/adsudbj8_csa_625x300_20_October_24.jpg?im=FeatureCrop,algorithm=dnn,width=1200,height=738",india is sensational  year streak ends with massive loss vs new zealand new zealand survived a hostile jasprit bumrah spell to foil india is attempt to add a final day twist to an absorbing series opener slaying the cricketing giants at home by eight wickets and ending a  chars,"['india', 'sensational', 'year', 'streak', 'ends', 'massive', 'loss', 'vs', 'new', 'zealand', 'new', 'zealand', 'survived', 'hostile', 'jasprit', 'bumrah', 'spell', 'foil', 'india', 'attempt', 'add', 'final', 'day', 'twist', 'absorbing', 'series', 'opener', 'slaying', 'cricketing', 'giants', 'home', 'eight', 'wickets', 'ending', 'chars']",india sensational year streak end massive loss v new zealand new zealand survived hostile jasprit bumrah spell foil india attempt add final day twist absorbing series opener slaying cricketing giant home eight wicket ending char
Watch: Virat Asks Bengaluru Crowd To Cheer During NZ Test. This Happens Next,NDTV Sports Desk,NDTV News,Indian cricket team star batter Virat Kohli was seen asking the Bengaluru crowd to cheer the team on Day 5 of the first Test encounter against New Zealand.,Indian cricket team star batter Virat Kohli was seen asking the Bengaluru crowd to cheer the team on Day 5 of the first Test encounter against New Zealand on Sunday. India came into the day needing 1… [+2681 chars],2024-10-20,https://sports.ndtv.com/india-vs-new-zealand-2024/virat-kohli-asks-bengaluru-crowd-to-cheer-during-new-zealand-test-this-happens-next-watch-6830580,"https://c.ndtvimg.com/2024-10/us149ipo_cs_625x300_20_October_24.jpeg?im=FeatureCrop,algorithm=dnn,width=1200,height=738",watch virat asks bengaluru crowd to cheer during nz test this happens next indian cricket team star batter virat kohli was seen asking the bengaluru crowd to cheer the team on day  of the first test encounter against new zealand on sunday india came into the day needing   chars,"['watch', 'virat', 'asks', 'bengaluru', 'crowd', 'cheer', 'nz', 'test', 'happens', 'next', 'indian', 'cricket', 'team', 'star', 'batter', 'virat', 'kohli', 'seen', 'asking', 'bengaluru', 'crowd', 'cheer', 'team', 'day', 'first', 'test', 'encounter', 'new', 'zealand', 'sunday', 'india', 'came', 'day', 'needing', 'chars']",watch virat asks bengaluru crowd cheer nz test happens next indian cricket team star batter virat kohli seen asking bengaluru crowd cheer team day first test encounter new zealand sunday india came day needing char
John Lancaster Gives Chennai Turbo Riders Fourth Win On Day 1 Of Indian Racing Festival Round 4,NDTV Sports Desk,NDTV News,Chennai Turbo Riders continued their relentless assault on the championship by clinching their fourth win of the season through veteran Britisher Jon Lancaster as the Round 4 of the Indian Racing League,Chennai Turbo Riders continued their relentless assault on the championship by clinching their fourth win of the season through veteran Britisher Jon Lancaster as the Round 4 of the Indian Racing Lea… [+3182 chars],2024-10-20,https://sports.ndtv.com/othersports/john-lancaster-gives-chennai-turbo-riders-fourth-win-on-day-1-of-indian-racing-festival-round-4-6830350,"https://c.ndtvimg.com/2024-10/30g4052g_jon-lancaster_625x300_20_October_24.jpeg?im=FitAndFill,algorithm=dnn,width=1200,height=738",john lancaster gives chennai turbo riders fourth win on day  of indian racing festival round  chennai turbo riders continued their relentless assault on the championship by clinching their fourth win of the season through veteran britisher jon lancaster as the round  of the indian racing lea  chars,"['john', 'lancaster', 'gives', 'chennai', 'turbo', 'riders', 'fourth', 'win', 'day', 'indian', 'racing', 'festival', 'round', 'chennai', 'turbo', 'riders', 'continued', 'relentless', 'assault', 'championship', 'clinching', 'fourth', 'win', 'season', 'veteran', 'britisher', 'jon', 'lancaster', 'round', 'indian', 'racing', 'lea', 'chars']",john lancaster give chennai turbo rider fourth win day indian racing festival round chennai turbo rider continued relentless assault championship clinching fourth win season veteran britisher jon lancaster round indian racing lea char
Watch: Greatest Catch Ever? Ramandeep's Effort vs Pakistan A Breaks Internet,NDTV Sports Desk,NDTV News,Ramandeep Singh left everyone stunned with a sensational catch during the Emerging Asia Cup clash between India A and Pakistan A on Saturday.,"Ramandeep Singh left everyone stunned with a sensational catch during the Emerging Asia Cup clash between India A and Pakistan A on Saturday. During the much-anticipated encounter, Pakistan A opener … [+2816 chars]",2024-10-20,https://sports.ndtv.com/cricket/greatest-catch-ever-ramandeep-singhs-effort-vs-pakistan-a-breaks-internet-watch-6829816,"https://c.ndtvimg.com/2024-10/fp6j0dj_cccc_625x300_20_October_24.jpeg?im=FeatureCrop,algorithm=dnn,width=1200,height=738",watch greatest catch ever ramandeep is effort vs pakistan a breaks internet ramandeep singh left everyone stunned with a sensational catch during the emerging asia cup clash between india a and pakistan a on saturday during the much anticipated encounter pakistan a opener  chars,"['watch', 'greatest', 'catch', 'ever', 'ramandeep', 'effort', 'vs', 'pakistan', 'breaks', 'internet', 'ramandeep', 'singh', 'left', 'everyone', 'stunned', 'sensational', 'catch', 'emerging', 'asia', 'cup', 'clash', 'india', 'pakistan', 'saturday', 'much', 'anticipated', 'encounter', 'pakistan', 'opener', 'chars']",watch greatest catch ever ramandeep effort v pakistan break internet ramandeep singh left everyone stunned sensational catch emerging asia cup clash india pakistan saturday much anticipated encounter pakistan opener char
