title,author,source,description,content,pub_date,url,photo_url,combined_text,tokens,lems
Boeing’s CEO Is Shrinking the Jet Maker to Stop Its Crisis From Spiraling,Sharon Terlep,The Wall Street Journal,"A strike by its machinists union could end soon, but the company remains in a perilous financial position.",The airline industrys biggest names donned gowns and tuxedos and filed into a Manhattan ballroom Friday for a night of cocktails and fretting about the future of Boeing.One group was conspicuously ab… [+6565 chars],2024-10-20,https://www.wsj.com/business/airlines/boeing-ceo-manufacturing-future-fe635fae,https://s.yimg.com/ny/api/res/1.2/h9jln2vOKlO_30MlTGbSZQ--/YXBwaWQ9aGlnaGxhbmRlcjt3PTEyMDA7aD02MDA-/https://media.zenfs.com/en/the_wall_street_journal_hosted_996/9e44f91cd324acd17b861b21a141629f,boeing s ceo is shrinking the jet maker to stop its crisis from spiraling the airline industrys biggest names donned gowns and tuxedos and filed into a manhattan ballroom friday for a night of cocktails and fretting about the future of boeing one group was conspicuously ab  chars,"['boeing', 'ceo', 'shrinking', 'jet', 'maker', 'stop', 'crisis', 'spiraling', 'airline', 'industrys', 'biggest', 'names', 'donned', 'gowns', 'tuxedos', 'filed', 'manhattan', 'ballroom', 'friday', 'night', 'cocktails', 'fretting', 'future', 'boeing', 'one', 'group', 'conspicuously', 'ab', 'chars']",boeing ceo shrinking jet maker stop crisis spiraling airline industry biggest name donned gown tuxedo filed manhattan ballroom friday night cocktail fretting future boeing one group conspicuously ab char
Prabowo vows to fight corruption as he is sworn in as Indonesia’s president,Al Jazeera,Al Jazeera English,Former general won the February presidential race with nearly 60 percent of the vote to succeed Joko Widodo.,"Prabowo Subianto has promised to combat corruption in Indonesia as he took oath as the president of the worlds fourth most populous country.
Wearing a traditional black hat and navy suit with a wove… [+3188 chars]",2024-10-20,https://www.aljazeera.com/news/2024/10/20/prabowo-vows-to-fight-corruption-as-he-is-sworn-in-as-indonesias-president,https://www.aljazeera.com/wp-content/uploads/2024/10/2024-10-20T070051Z_1264425409_RC23OAA81X7D_RTRMADP_3_INDONESIA-POLITICS-INAUGURATION-1729409809.jpg?resize=1920%2C1440,prabowo vows to fight corruption as he is sworn in as indonesia s president prabowo subianto has promised to combat corruption in indonesia as he took oath as the president of the worlds fourth most populous country wearing a traditional black hat and navy suit with a wove  chars,"['prabowo', 'vows', 'fight', 'corruption', 'sworn', 'indonesia', 'president', 'prabowo', 'subianto', 'promised', 'combat', 'corruption', 'indonesia', 'took', 'oath', 'president', 'worlds', 'fourth', 'populous', 'country', 'wearing', 'traditional', 'black', 'hat', 'navy', 'suit', 'wove', 'chars']",prabowo vow fight corruption sworn indonesia president prabowo subianto promised combat corruption indonesia took oath president world fourth populous country wearing traditional black hat navy suit wove char
India vs New Zealand: Black Caps record first Test win in India since 1988,Al Jazeera,Al Jazeera English,Rachin Ravindra and Will Young guide Black Caps home on fifth day of the rain-hit first Test in Bengaluru.,"New Zealand have defeated the men in blue by eight wickets, securing their first Test victory in India since 1988, as the Black Caps chased down 107 and humbled the home side early on the final day o… [+1275 chars]",2024-10-20,https://www.aljazeera.com/sports/2024/10/20/india-vs-new-zealand-black-caps-record-first-test-win-in-india-since-1988,https://www.aljazeera.com/wp-content/uploads/2024/10/AFP__20241020__36KH3K7__v1__HighRes__CricketIndNzlTest-1729408566.jpg?resize=1920%2C1440,india vs new zealand black caps record first test win in india since  new zealand have defeated the men in blue by eight wickets securing their first test victory in india since  as the black caps chased down  and humbled the home side early on the final day o  chars,"['india', 'vs', 'new', 'zealand', 'black', 'caps', 'record', 'first', 'test', 'win', 'india', 'since', 'new', 'zealand', 'defeated', 'men', 'blue', 'eight', 'wickets', 'securing', 'first', 'test', 'victory', 'india', 'since', 'black', 'caps', 'chased', 'humbled', 'home', 'side', 'early', 'final', 'day', 'chars']",india v new zealand black cap record first test win india since new zealand defeated men blue eight wicket securing first test victory india since black cap chased humbled home side early final day char
Marc Marquez wins Australian MotoGP after epic battle with Jorge Martin,Al Jazeera,Al Jazeera English,Marquez overcomes a drop outside the top 10 to battle his way back in front and win his third race of the season.,"Six-time champion Marc Marquez of Gresini Racing put on a master class to win the Australian Motorcycle Grand Prix (MotoGP) ahead of world championship leader Jorge Martin at Phillip Island, with Fra… [+2502 chars]",2024-10-20,https://www.aljazeera.com/sports/2024/10/20/marc-marquez-wins-australian-motogp-after-epic-battle-with-jorge-martin,https://www.aljazeera.com/wp-content/uploads/2024/10/AFP__20241020__36KE4DF__v1__HighRes__MotoPrixAus-1729407120.jpg?resize=1920%2C1440,marc marquez wins australian motogp after epic battle with jorge martin six time champion marc marquez of gresini racing put on a master class to win the australian motorcycle grand prix motogp ahead of world championship leader jorge martin at phillip island with fra  chars,"['marc', 'marquez', 'wins', 'australian', 'motogp', 'epic', 'battle', 'jorge', 'martin', 'six', 'time', 'champion', 'marc', 'marquez', 'gresini', 'racing', 'put', 'master', 'class', 'win', 'australian', 'motorcycle', 'grand', 'prix', 'motogp', 'ahead', 'world', 'championship', 'leader', 'jorge', 'martin', 'phillip', 'island', 'fra', 'chars']",marc marquez win australian motogp epic battle jorge martin six time champion marc marquez gresini racing put master class win australian motorcycle grand prix motogp ahead world championship leader jorge martin phillip island fra char
‘No other land’: Palestinian Bedouins forced out under cover of Gaza war,"Shaima Madboly, Faris Ka’abneh",Al Jazeera English,"Bedouins lived in Wadi as-Seeq for 50 years. After October 7, they were forced out of their homes.","The Palestinian Bedouins of the West Bank do not have time to wait for Israeli Jews to turn against their governments policy towards them.
Instead, they rely on their own resilience - or, in Arabic,… [+4779 chars]",2024-10-20,https://www.aljazeera.com/features/longform/2024/10/20/no-other-land-palestinian-bedouins-forced-out-under-cover-of-gaza-war,https://www.aljazeera.com/wp-content/uploads/2024/10/4-1728247798.jpg?resize=1920%2C1440,no other land palestinian bedouins forced out under cover of gaza war the palestinian bedouins of the west bank do not have time to wait for israeli jews to turn against their governments policy towards them instead they rely on their own resilience or in arabic  chars,"['land', 'palestinian', 'bedouins', 'forced', 'cover', 'gaza', 'war', 'palestinian', 'bedouins', 'west', 'bank', 'time', 'wait', 'israeli', 'jews', 'turn', 'governments', 'policy', 'towards', 'instead', 'rely', 'resilience', 'arabic', 'chars']",land palestinian bedouin forced cover gaza war palestinian bedouin west bank time wait israeli jew turn government policy towards instead rely resilience arabic char
At least 73 killed in Israeli strike in northern Gaza’s Beit Lahiya,Al Jazeera,Al Jazeera English,"Attack levels a multistorey residential building, with many people trapped under the rubble and rescue efforts hampered.","An Israeli air attack has killed at least 73 Palestinians, including women and children, in Beit Lahiya in the northern Gaza Strip, the authorities said, describing it as a massacre.
The overnight s… [+2841 chars]",2024-10-20,https://www.aljazeera.com/news/2024/10/20/dozens-killed-in-israeli-strike-in-northern-gazas-beit-lahiya,https://www.aljazeera.com/wp-content/uploads/2024/10/AFP__20241019__36KC98M__v1__HighRes__PalestinianIsraelConflict-1729406014.jpg?resize=1920%2C1440,at least  killed in israeli strike in northern gaza s beit lahiya an israeli air attack has killed at least  palestinians including women and children in beit lahiya in the northern gaza strip the authorities said describing it as a massacre the overnight s  chars,"['least', 'killed', 'israeli', 'strike', 'northern', 'gaza', 'beit', 'lahiya', 'israeli', 'air', 'attack', 'killed', 'least', 'palestinians', 'including', 'women', 'children', 'beit', 'lahiya', 'northern', 'gaza', 'strip', 'authorities', 'said', 'describing', 'massacre', 'overnight', 'chars']",least killed israeli strike northern gaza beit lahiya israeli air attack killed least palestinian including woman child beit lahiya northern gaza strip authority said describing massacre overnight char
Cameroon’s Francis Ngannou knocks out Renan Ferreira in MMA return,Al Jazeera,Al Jazeera English,Tearful Ngannou dedicates his comprehensive heavyweight title win to the memory of his late 15-month-old son Kobe.,Cameroons Francis Ngannou made a triumphant return to mixed martial arts by knocking out Renan Ferreria in the first round of their heavyweight clash at the Professional Fighters League (PFL) event d… [+1411 chars],2024-10-20,https://www.aljazeera.com/gallery/2024/10/20/cameroons-francis-ngannou-knocks-out-renan-ferreira-in-mma-return,https://www.aljazeera.com/wp-content/uploads/2024/10/AFP__20241018__36KD4NT__v2__Preview__MmaKsaPflNgannouFerreira-1729410789.jpg?resize=1200%2C630,cameroon s francis ngannou knocks out renan ferreira in mma return cameroons francis ngannou made a triumphant return to mixed martial arts by knocking out renan ferreria in the first round of their heavyweight clash at the professional fighters league pfl event d  chars,"['cameroon', 'francis', 'ngannou', 'knocks', 'renan', 'ferreira', 'mma', 'return', 'cameroons', 'francis', 'ngannou', 'made', 'triumphant', 'return', 'mixed', 'martial', 'arts', 'knocking', 'renan', 'ferreria', 'first', 'round', 'heavyweight', 'clash', 'professional', 'fighters', 'league', 'pfl', 'event', 'chars']",cameroon francis ngannou knock renan ferreira mma return cameroon francis ngannou made triumphant return mixed martial art knocking renan ferreria first round heavyweight clash professional fighter league pfl event char
State of the race: Five takeaways 17 days out from the US election,Al Jazeera Staff,Al Jazeera English,What's the latest on the race between Kamala Harris and Donald Trump? Al Jazeera breaks down the week's election news.,"Its been another whirlwind week in United States politics. And with just over two weeks left in the presidential race, the candidates are preparing to make their final appeals to voters.
What have K… [+7505 chars]",2024-10-20,https://www.aljazeera.com/news/2024/10/20/state-of-the-race-five-takeaways-seventeen-days-out-from-us-election,https://www.aljazeera.com/wp-content/uploads/2024/10/AP24294052018043-1729389427.jpg?resize=1920%2C1440,state of the race five takeaways  days out from the us election its been another whirlwind week in united states politics and with just over two weeks left in the presidential race the candidates are preparing to make their final appeals to voters what have k  chars,"['state', 'race', 'five', 'takeaways', 'days', 'us', 'election', 'another', 'whirlwind', 'week', 'united', 'states', 'politics', 'two', 'weeks', 'left', 'presidential', 'race', 'candidates', 'preparing', 'make', 'final', 'appeals', 'voters', 'k', 'chars']",state race five takeaway day u election another whirlwind week united state politics two week left presidential race candidate preparing make final appeal voter k char
"Russia-Ukraine war: List of key events, day 968",Al Jazeera,Al Jazeera English,"As the war enters its 968th day, these are the main developments.","Here is the situation on Sunday, October 20, 2024.
Fighting
<ul><li>Ukraine launched a series of drones targeting Moscow and western Russia, according to regional officials.</li><li>Russian air def… [+2286 chars]",2024-10-20,https://www.aljazeera.com/news/2024/10/20/russia-ukraine-conflict-list-of-key-events-day-968,https://www.aljazeera.com/wp-content/uploads/2024/10/2024-10-19T111218Z_438362277_RC2NNAAH3UNV_RTRMADP_3_G7-DEFENCE-1729403915.jpg?resize=1920%2C1440,russia ukraine war list of key events day  here is the situation on sunday october   fighting ul li ukraine launched a series of drones targeting moscow and western russia according to regional officials li li russian air def  chars,"['russia', 'ukraine', 'war', 'list', 'key', 'events', 'day', 'situation', 'sunday', 'october', 'fighting', 'ul', 'li', 'ukraine', 'launched', 'series', 'drones', 'targeting', 'moscow', 'western', 'russia', 'according', 'regional', 'officials', 'li', 'li', 'russian', 'air', 'def', 'chars']",russia ukraine war list key event day situation sunday october fighting ul li ukraine launched series drone targeting moscow western russia according regional official li li russian air def char
Seven killed as ferry dock collapses on US Atlantic coast off Georgia,Al Jazeera,Al Jazeera English,A team of engineers and construction specialists will begin an investigation into why the gangway collapsed.,"At least seven people were killed after part of a ferry dock collapsed off the coast of the US state of Georgia, the authorities say, where crowds had gathered for an autumn celebration.
The inciden… [+2613 chars]",2024-10-20,https://www.aljazeera.com/news/2024/10/20/several-killed-as-ferry-dock-collapses-on-us-atlantic-coast-off-georgia,https://www.aljazeera.com/wp-content/uploads/2024/10/AP24293854009091-1729408367.jpg?resize=1920%2C1440,seven killed as ferry dock collapses on us atlantic coast off georgia at least seven people were killed after part of a ferry dock collapsed off the coast of the us state of georgia the authorities say where crowds had gathered for an autumn celebration the inciden  chars,"['seven', 'killed', 'ferry', 'dock', 'collapses', 'us', 'atlantic', 'coast', 'georgia', 'least', 'seven', 'people', 'killed', 'part', 'ferry', 'dock', 'collapsed', 'coast', 'us', 'state', 'georgia', 'authorities', 'say', 'crowds', 'gathered', 'autumn', 'celebration', 'inciden', 'chars']",seven killed ferry dock collapse u atlantic coast georgia least seven people killed part ferry dock collapsed coast u state georgia authority say crowd gathered autumn celebration inciden char
Messi scores hat-trick as Inter Miami enter Club World Cup 2025,Al Jazeera,Al Jazeera English,Inter Miami beat New England 6-2 to break the MLS regular season points record and seal a berth at the Club World Cup.,On-fire Lionel Messi scored his second hat-trick of the week and Luis Suarez scored twice as Inter Miami beat the New England Revolution 6-2 to smash Major League Soccers regular season points record… [+3855 chars],2024-10-20,https://www.aljazeera.com/sports/2024/10/20/messi-scores-hat-trick-as-inter-miami-enter-club-world-cup-2025,https://www.aljazeera.com/wp-content/uploads/2024/10/AFP__20241020__36KG94P__v1__HighRes__FootballMajorLeagueSoccerMlsRegularSeasonInterM-1729404794.jpg?resize=1920%2C1440,messi scores hat trick as inter miami enter club world cup  on fire lionel messi scored his second hat trick of the week and luis suarez scored twice as inter miami beat the new england revolution   to smash major league soccers regular season points record  chars,"['messi', 'scores', 'hat', 'trick', 'inter', 'miami', 'enter', 'club', 'world', 'cup', 'fire', 'lionel', 'messi', 'scored', 'second', 'hat', 'trick', 'week', 'luis', 'suarez', 'scored', 'twice', 'inter', 'miami', 'beat', 'new', 'england', 'revolution', 'smash', 'major', 'league', 'soccers', 'regular', 'season', 'points', 'record', 'chars']",messi score hat trick inter miami enter club world cup fire lionel messi scored second hat trick week luis suarez scored twice inter miami beat new england revolution smash major league soccer regular season point record char
Starving since the day he was born: How famine stalks Gaza’s children,Mark Scialla,Al Jazeera English,"Bereaved parents, doctors, aid workers and former US officials describe the human toll of Israel's restrictions on aid.","Not seen as fully human
But it's not just delivering aid that can be deadly. Many civilians have been killed while collecting it. In February, more than 100 Palestinians seeking food from aid trucks… [+6199 chars]",2024-10-20,https://www.aljazeera.com/features/longform/2024/10/20/starving-since-the-day-he-was-born-how-famine-stalks-gazas-children,https://www.aljazeera.com/wp-content/uploads/2024/10/Baby_Breathing-1729250304.jpg?resize=1620%2C1080&quality=80,starving since the day he was born how famine stalks gaza s children not seen as fully human but it is not just delivering aid that can be deadly many civilians have been killed while collecting it in february more than  palestinians seeking food from aid trucks  chars,"['starving', 'since', 'day', 'born', 'famine', 'stalks', 'gaza', 'children', 'seen', 'fully', 'human', 'delivering', 'aid', 'deadly', 'many', 'civilians', 'killed', 'collecting', 'february', 'palestinians', 'seeking', 'food', 'aid', 'trucks', 'chars']",starving since day born famine stalk gaza child seen fully human delivering aid deadly many civilian killed collecting february palestinian seeking food aid truck char
LIVE: Huge Israeli strike kills more than 70 in north Gaza’s Beit Lahiya,Lyndal Rowlands,Al Jazeera English,Multiple air strikes on residential area in Beit Lahiya come amid punishing weeks-long Israeli siege of north Gaza.,"blinking-dot
Live updatesLive updates, 
Multiple air strikes on residential area in Beit Lahiya carried out amid punishing weeks-long Israeli military siege of northern Gaza.",2024-10-20,https://www.aljazeera.com/news/liveblog/2024/10/20/live-dozens-killed-in-israeli-attack-on-beit-lahiya-in-north-of-gaza,https://www.aljazeera.com/wp-content/uploads/2024/10/AA-20241019-35953060-35953058-ISRAELI_ATTACK_ON_MAGHAZI_REFUGEE_CAMP_IN_DEIR_ALBALAH-1729381680.jpg?resize=1200%2C630,live huge israeli strike kills more than  in north gaza s beit lahiya blinking dot live updateslive updates multiple air strikes on residential area in beit lahiya carried out amid punishing weeks long israeli military siege of northern gaza,"['live', 'huge', 'israeli', 'strike', 'kills', 'north', 'gaza', 'beit', 'lahiya', 'blinking', 'dot', 'live', 'updateslive', 'updates', 'multiple', 'air', 'strikes', 'residential', 'area', 'beit', 'lahiya', 'carried', 'amid', 'punishing', 'weeks', 'long', 'israeli', 'military', 'siege', 'northern', 'gaza']",live huge israeli strike kill north gaza beit lahiya blinking dot live updateslive update multiple air strike residential area beit lahiya carried amid punishing week long israeli military siege northern gaza
Caught at the helm,BBC World Service,BBC News,"Katy Fallon tells the story of the refugees and other migrants ensnared in Greece’s legal crossfire. Greek authorities routinely prosecute those found near the controls of boats carrying people trying to reach Europe, but human rights monitors assert that it …",Katy Fallon tells the story of the refugees and other migrants ensnared in Greeces legal crossfire. Greek authorities routinely prosecute those found near the controls of boats carrying people trying… [+543 chars],2024-10-20,https://www.bbc.co.uk/programmes/p0jy4mch,https://ichef.bbci.co.uk/images/ic/1200x675/p0css1dx.jpg,caught at the helm katy fallon tells the story of the refugees and other migrants ensnared in greeces legal crossfire greek authorities routinely prosecute those found near the controls of boats carrying people trying  chars,"['caught', 'helm', 'katy', 'fallon', 'tells', 'story', 'refugees', 'migrants', 'ensnared', 'greeces', 'legal', 'crossfire', 'greek', 'authorities', 'routinely', 'prosecute', 'found', 'near', 'controls', 'boats', 'carrying', 'people', 'trying', 'chars']",caught helm katy fallon tell story refugee migrant ensnared greece legal crossfire greek authority routinely prosecute found near control boat carrying people trying char
Clocks to go back as autumn weather takes hold,Barra Best,BBC News,"At 02:00 BST on 27 October clocks will go back by one hour, providing an extra hour in bed for many.","The clock change is rooted in a century-old practice designed to make better use of daylight during the winter months.
By shifting an hour of sunlight from the evening to the morning, the goal is to… [+1145 chars]",2024-10-20,https://www.bbc.co.uk/news/articles/cm28gv44rz3o,https://ichef.bbci.co.uk/news/1024/branded_news/e41c/live/ec6d0a30-8afe-11ef-8dd9-115a8781b651.jpg,clocks to go back as autumn weather takes hold the clock change is rooted in a century old practice designed to make better use of daylight during the winter months by shifting an hour of sunlight from the evening to the morning the goal is to  chars,"['clocks', 'go', 'back', 'autumn', 'weather', 'takes', 'hold', 'clock', 'change', 'rooted', 'century', 'old', 'practice', 'designed', 'make', 'better', 'use', 'daylight', 'winter', 'months', 'shifting', 'hour', 'sunlight', 'evening', 'morning', 'goal', 'chars']",clock go back autumn weather take hold clock change rooted century old practice designed make better use daylight winter month shifting hour sunlight evening morning goal char
Why are we building homes when so many are standing empty?,Brian Wheeler,BBC News,"Bringing empty homes back into use can be tricky, but campaigners say a lot more could be done to help.","In an average working day, Claudia Bowring has to play the role of detective, estate agent, family mediator and, occasionally, grief counsellor.
Shes an empty homes officer for a borough council in … [+1853 chars]",2024-10-20,https://www.bbc.co.uk/news/articles/c4g518le0r5o,https://ichef.bbci.co.uk/news/1024/branded_news/bb6b/live/80655fc0-8eca-11ef-8dd3-bb530ef3f124.jpg,why are we building homes when so many are standing empty in an average working day claudia bowring has to play the role of detective estate agent family mediator and occasionally grief counsellor shes an empty homes officer for a borough council in  chars,"['building', 'homes', 'many', 'standing', 'empty', 'average', 'working', 'day', 'claudia', 'bowring', 'play', 'role', 'detective', 'estate', 'agent', 'family', 'mediator', 'occasionally', 'grief', 'counsellor', 'shes', 'empty', 'homes', 'officer', 'borough', 'council', 'chars']",building home many standing empty average working day claudia bowring play role detective estate agent family mediator occasionally grief counsellor shes empty home officer borough council char
HS2: Ministers to oversee build as costs 'spiral',Charlotte Edwards,BBC News,The transport secretary also commissions a new independent review of the high-speed rail project.,"A spokesperson for HS2 Ltd said: We welcome the Secretary of State's priorities for HS2 Ltd and are committed to working with the new Government to improve delivery.""
Adding: ""HS2 Ltd recognises tha… [+1259 chars]",2024-10-20,https://www.bbc.co.uk/news/articles/cr54gv99dz1o,https://ichef.bbci.co.uk/news/1024/branded_news/cd19/live/14d71310-8ebc-11ef-a2c3-7f007b57e467.jpg,hs ministers to oversee build as costs is piral a spokesperson for hs ltd said we welcome the secretary of state is priorities for hs ltd and are committed to working with the new government to improve delivery adding hs ltd recognises tha  chars,"['hs', 'ministers', 'oversee', 'build', 'costs', 'piral', 'spokesperson', 'hs', 'ltd', 'said', 'welcome', 'secretary', 'state', 'priorities', 'hs', 'ltd', 'committed', 'working', 'new', 'government', 'improve', 'delivery', 'adding', 'hs', 'ltd', 'recognises', 'tha', 'chars']",h minister oversee build cost piral spokesperson h ltd said welcome secretary state priority h ltd committed working new government improve delivery adding h ltd recognises tha char
Lucy Letby: We spent years covering the case – here’s why experts are still arguing about it,Jonathan Coffey And Judith Moritz,BBC News,"For more than a year, we’ve been examining the scientific evidence and speaking to the experts at the centre of the case.","The medical condition of the babies also fitted with the lab results. In both cases, the babies blood sugar levels had plummeted, which is what you would expect to see with insulin poisoning. And whi… [+2087 chars]",2024-10-20,https://www.bbc.co.uk/news/articles/cvgwx9xprwqo,https://ichef.bbci.co.uk/news/1024/branded_news/d919/live/a27d4ec0-8d61-11ef-89ae-5575c76d98e6.png,lucy letby we spent years covering the case here s why experts are still arguing about it the medical condition of the babies also fitted with the lab results in both cases the babies blood sugar levels had plummeted which is what you would expect to see with insulin poisoning and whi  chars,"['lucy', 'letby', 'spent', 'years', 'covering', 'case', 'experts', 'still', 'arguing', 'medical', 'condition', 'babies', 'also', 'fitted', 'lab', 'results', 'cases', 'babies', 'blood', 'sugar', 'levels', 'plummeted', 'would', 'expect', 'see', 'insulin', 'poisoning', 'whi', 'chars']",lucy letby spent year covering case expert still arguing medical condition baby also fitted lab result case baby blood sugar level plummeted would expect see insulin poisoning whi char
